title,summary,authors,published,url,pdf_url,categories
Population-aware Online Mirror Descent for Mean-Field Games with Common Noise by Deep Reinforcement Learning,"Mean Field Games (MFGs) offer a powerful framework for studying large-scale
multi-agent systems. Yet, learning Nash equilibria in MFGs remains a
challenging problem, particularly when the initial distribution is unknown or
when the population is subject to common noise. In this paper, we introduce an
efficient deep reinforcement learning (DRL) algorithm designed to achieve
population-dependent Nash equilibria without relying on averaging or historical
sampling, inspired by Munchausen RL and Online Mirror Descent. The resulting
policy is adaptable to various initial distributions and sources of common
noise. Through numerical experiments on seven canonical examples, we
demonstrate that our algorithm exhibits superior convergence properties
compared to state-of-the-art algorithms, particularly a DRL version of
Fictitious Play for population-dependent policies. The performance in the
presence of common noise underscores the robustness and adaptability of our
approach.","Zida Wu, Mathieu Lauriere, Matthieu Geist, Olivier Pietquin, Ankur Mehta",2025-09-03 05:33:46+00:00,http://arxiv.org/abs/2509.03030v1,http://arxiv.org/pdf/2509.03030v1,"cs.LG, cs.MA, cs.RO, cs.SY, eess.SY"
Uncertainty-aware Test-Time Training (UT$^3$) for Efficient On-the-fly Domain Adaptive Dense Regression,"Deep neural networks (DNNs) are increasingly being used in autonomous
systems. However, DNNs do not generalize well to domain shift. Adapting to a
continuously evolving environment is a safety-critical challenge inevitably
faced by all autonomous systems deployed to the real world. Recent work on
test-time training proposes methods that adapt to a new test distribution on
the fly by optimizing the DNN model for each test input using self-supervision.
However, these techniques result in a sharp increase in inference time as
multiple forward and backward passes are required for a single test sample (for
test-time training) before finally making the prediction based on the
fine-tuned features. This is undesirable for real-world robotics applications
where these models may be deployed to resource constraint hardware with strong
latency requirements. In this work, we propose a new framework (called UT$^3$)
that leverages test-time training for improved performance in the presence of
continuous domain shift while also decreasing the inference time, making it
suitable for real-world applications. Our method proposes an uncertainty-aware
self-supervision task for efficient test-time training that leverages the
quantified uncertainty to selectively apply the training leading to sharp
improvements in the inference time while performing comparably to standard
test-time training protocol. Our proposed protocol offers a continuous setting
to identify the selected keyframes, allowing the end-user to control how often
to apply test-time training. We demonstrate the efficacy of our method on a
dense regression task - monocular depth estimation.",Uddeshya Upadhyay,2025-09-03 04:41:43+00:00,http://arxiv.org/abs/2509.03012v1,http://arxiv.org/pdf/2509.03012v1,"cs.RO, cs.CV"
CTBC: Contact-Triggered Blind Climbing for Wheeled Bipedal Robots with Instruction Learning and Reinforcement Learning,"In recent years, wheeled bipedal robots have gained increasing attention due
to their advantages in mobility, such as high-speed locomotion on flat terrain.
However, their performance on complex environments (e.g., staircases) remains
inferior to that of traditional legged robots. To overcome this limitation, we
propose a general contact-triggered blind climbing (CTBC) framework for wheeled
bipedal robots. Upon detecting wheel-obstacle contact, the robot triggers a
leg-lifting motion to overcome the obstacle. By leveraging a strongly-guided
feedforward trajectory, our method enables the robot to rapidly acquire agile
leg-lifting skills, significantly enhancing its capability to traverse
unstructured terrains. The approach has been experimentally validated and
successfully deployed on LimX Dynamics' wheeled bipedal robot, Tron1.
Real-world tests demonstrate that Tron1 can reliably climb obstacles well
beyond its wheel radius using only proprioceptive feedback.","Rankun Li, Hao Wang, Qi Li, Zhuo Han, Yifei Chu, Linqi Ye, Wende Xie, Wenlong Liao",2025-09-03 03:46:43+00:00,http://arxiv.org/abs/2509.02986v1,http://arxiv.org/pdf/2509.02986v1,cs.RO
DUViN: Diffusion-Based Underwater Visual Navigation via Knowledge-Transferred Depth Features,"Autonomous underwater navigation remains a challenging problem due to limited
sensing capabilities and the difficulty of constructing accurate maps in
underwater environments. In this paper, we propose a Diffusion-based Underwater
Visual Navigation policy via knowledge-transferred depth features, named DUViN,
which enables vision-based end-to-end 4-DoF motion control for underwater
vehicles in unknown environments. DUViN guides the vehicle to avoid obstacles
and maintain a safe and perception awareness altitude relative to the terrain
without relying on pre-built maps. To address the difficulty of collecting
large-scale underwater navigation datasets, we propose a method that ensures
robust generalization under domain shifts from in-air to underwater
environments by leveraging depth features and introducing a novel model
transfer strategy. Specifically, our training framework consists of two phases:
we first train the diffusion-based visual navigation policy on in-air datasets
using a pre-trained depth feature extractor. Secondly, we retrain the extractor
on an underwater depth estimation task and integrate the adapted extractor into
the trained navigation policy from the first step. Experiments in both
simulated and real-world underwater environments demonstrate the effectiveness
and generalization of our approach. The experimental videos are available at
https://www.youtube.com/playlist?list=PLqt2s-RyCf1gfXJgFzKjmwIqYhrP4I-7Y.","Jinghe Yang, Minh-Quan Le, Mingming Gong, Ye Pu",2025-09-03 03:43:12+00:00,http://arxiv.org/abs/2509.02983v1,http://arxiv.org/pdf/2509.02983v1,"cs.RO, cs.CV"
IL-SLAM: Intelligent Line-assisted SLAM Based on Feature Awareness for Dynamic Environments,"Visual Simultaneous Localization and Mapping (SLAM) plays a crucial role in
autonomous systems. Traditional SLAM methods, based on static environment
assumptions, struggle to handle complex dynamic environments. Recent dynamic
SLAM systems employ geometric constraints and deep learning to remove dynamic
features, yet this creates a new challenge: insufficient remaining point
features for subsequent SLAM processes. Existing solutions address this by
continuously introducing additional line and plane features to supplement point
features, achieving robust tracking and pose estimation. However, current
methods continuously introduce additional features regardless of necessity,
causing two problems: unnecessary computational overhead and potential
performance degradation from accumulated low-quality additional features and
noise. To address these issues, this paper proposes a feature-aware mechanism
that evaluates whether current features are adequate to determine if line
feature support should be activated. This decision mechanism enables the system
to introduce line features only when necessary, significantly reducing
computational complexity of additional features while minimizing the
introduction of low-quality features and noise. In subsequent processing, the
introduced line features assist in obtaining better initial camera poses
through tracking, local mapping, and loop closure, but are excluded from global
optimization to avoid potential negative impacts from low-quality additional
features in long-term process. Extensive experiments on TUM datasets
demonstrate substantial improvements in both ATE and RPE metrics compared to
ORB-SLAM3 baseline and superior performance over other dynamic SLAM and
multi-feature methods.","Haolan Zhang, Thanh Nguyen Canh, Chenghao Li, Ruidong Yang, Yonghoon Ji, Nak Young Chong",2025-09-03 03:19:09+00:00,http://arxiv.org/abs/2509.02972v1,http://arxiv.org/pdf/2509.02972v1,cs.RO
VendiRL: A Framework for Self-Supervised Reinforcement Learning of Diversely Diverse Skills,"In self-supervised reinforcement learning (RL), one of the key challenges is
learning a diverse set of skills to prepare agents for unknown future tasks.
Despite impressive advances, scalability and evaluation remain prevalent
issues. Regarding scalability, the search for meaningful skills can be obscured
by high-dimensional feature spaces, where relevant features may vary across
downstream task domains. For evaluating skill diversity, defining what
constitutes ""diversity"" typically requires a hard commitment to a specific
notion of what it means for skills to be diverse, potentially leading to
inconsistencies in how skill diversity is understood, making results across
different approaches hard to compare, and leaving many forms of diversity
unexplored. To address these issues, we adopt a measure of sample diversity
that translates ideas from ecology to machine learning -- the Vendi Score --
allowing the user to specify and evaluate any desired form of diversity. We
demonstrate how this metric facilitates skill evaluation and introduce VendiRL,
a unified framework for learning diversely diverse sets of skills. Given
distinct similarity functions, VendiRL motivates distinct forms of diversity,
which could support skill-diversity pretraining in new and richly interactive
environments where optimising for various forms of diversity may be desirable.",Erik M. Lintunen,2025-09-03 01:53:29+00:00,http://arxiv.org/abs/2509.02930v1,http://arxiv.org/pdf/2509.02930v1,"cs.LG, cs.AI, cs.RO"
Approximate constrained stochastic optimal control via parameterized input inference,"Approximate methods to solve stochastic optimal control (SOC) problems have
received significant interest from researchers in the past decade.
Probabilistic inference approaches to SOC have been developed to solve
nonlinear quadratic Gaussian problems. In this work, we propose an
Expectation-Maximization (EM) based inference procedure to generate
state-feedback controls for constrained SOC problems. We consider the
inequality constraints for the state and controls and also the structural
constraints for the controls. We employ barrier functions to address state and
control constraints. We show that the expectation step leads to smoothing of
the state-control pair while the the maximization step on the non-zero subsets
of the control parameters allows inference of structured stochastic optimal
controllers. We demonstrate the effectiveness of the algorithm on unicycle
obstacle avoidance, four-unicycle formation control, and quadcopter navigation
in windy environment examples. In these examples, we perform an empirical study
on the parametric effect of barrier functions on the state constraint
satisfaction. We also present a comparative study of smoothing algorithms on
the performance of the proposed approach.","Shahbaz P Qadri Syed, He Bai",2025-09-03 01:19:40+00:00,http://arxiv.org/abs/2509.02922v1,http://arxiv.org/pdf/2509.02922v1,"eess.SY, cs.MA, cs.RO, cs.SY, math.OC"
"Generalizable Skill Learning for Construction Robots with Crowdsourced Natural Language Instructions, Composable Skills Standardization, and Large Language Model","The quasi-repetitive nature of construction work and the resulting lack of
generalizability in programming construction robots presents persistent
challenges to the broad adoption of robots in the construction industry. Robots
cannot achieve generalist capabilities as skills learnt from one domain cannot
readily transfer to another work domain or be directly used to perform a
different set of tasks. Human workers have to arduously reprogram their
scene-understanding, path-planning, and manipulation components to enable the
robots to perform alternate work tasks. The methods presented in this paper
resolve a significant proportion of such reprogramming workload by proposing a
generalizable learning architecture that directly teaches robots versatile
task-performance skills through crowdsourced online natural language
instructions. A Large Language Model (LLM), a standardized and modularized
hierarchical modeling approach, and Building Information Modeling-Robot sematic
data pipeline are developed to address the multi-task skill transfer problem.
The proposed skill standardization scheme and LLM-based hierarchical skill
learning framework were tested with a long-horizon drywall installation
experiment using a full-scale industrial robotic manipulator. The resulting
robot task learning scheme achieves multi-task reprogramming with minimal
effort and high quality.","Hongrui Yu, Vineet R. Kamat, Carol C. Menassa",2025-09-02 22:46:27+00:00,http://arxiv.org/abs/2509.02876v1,http://arxiv.org/pdf/2509.02876v1,cs.RO
Robotic 3D Flower Pose Estimation for Small-Scale Urban Farms,"The small scale of urban farms and the commercial availability of low-cost
robots (such as the FarmBot) that automate simple tending tasks enable an
accessible platform for plant phenotyping. We have used a FarmBot with a custom
camera end-effector to estimate strawberry plant flower pose (for robotic
pollination) from acquired 3D point cloud models. We describe a novel algorithm
that translates individual occupancy grids along orthogonal axes of a point
cloud to obtain 2D images corresponding to the six viewpoints. For each image,
2D object detection models for flowers are used to identify 2D bounding boxes
which can be converted into the 3D space to extract flower point clouds. Pose
estimation is performed by fitting three shapes (superellipsoids, paraboloids
and planes) to the flower point clouds and compared with manually labeled
ground truth. Our method successfully finds approximately 80% of flowers
scanned using our customized FarmBot platform and has a mean flower pose error
of 7.7 degrees, which is sufficient for robotic pollination and rivals previous
results. All code will be made available at
https://github.com/harshmuriki/flowerPose.git.","Harsh Muriki, Hong Ray Teo, Ved Sengupta, Ai-Ping Hu",2025-09-02 22:36:10+00:00,http://arxiv.org/abs/2509.02870v1,http://arxiv.org/pdf/2509.02870v1,cs.RO
Multi-Embodiment Locomotion at Scale with extreme Embodiment Randomization,"We present a single, general locomotion policy trained on a diverse
collection of 50 legged robots. By combining an improved embodiment-aware
architecture (URMAv2) with a performance-based curriculum for extreme
Embodiment Randomization, our policy learns to control millions of
morphological variations. Our policy achieves zero-shot transfer to unseen
real-world humanoid and quadruped robots.","Nico Bohlinger, Jan Peters",2025-09-02 20:32:02+00:00,http://arxiv.org/abs/2509.02815v1,http://arxiv.org/pdf/2509.02815v1,"cs.RO, cs.LG"
Improving the Resilience of Quadrotors in Underground Environments by Combining Learning-based and Safety Controllers,"Autonomously controlling quadrotors in large-scale subterranean environments
is applicable to many areas such as environmental surveying, mining operations,
and search and rescue. Learning-based controllers represent an appealing
approach to autonomy, but are known to not generalize well to
`out-of-distribution' environments not encountered during training. In this
work, we train a normalizing flow-based prior over the environment, which
provides a measure of how far out-of-distribution the quadrotor is at any given
time. We use this measure as a runtime monitor, allowing us to switch between a
learning-based controller and a safe controller when we are sufficiently
out-of-distribution. Our methods are benchmarked on a point-to-point navigation
task in a simulated 3D cave environment based on real-world point cloud data
from the DARPA Subterranean Challenge Final Event Dataset. Our experimental
results show that our combined controller simultaneously possesses the liveness
of the learning-based controller (completing the task quickly) and the safety
of the safety controller (avoiding collision).","Isaac Ronald Ward, Mark Paral, Kristopher Riordan, Mykel J. Kochenderfer",2025-09-02 20:22:54+00:00,http://arxiv.org/abs/2509.02808v1,http://arxiv.org/pdf/2509.02808v1,"cs.RO, cs.AI, cs.SY, eess.SY"
A Digital Twin for Robotic Post Mortem Tissue Sampling using Virtual Reality,"Studying tissue samples obtained during autopsies is the gold standard when
diagnosing the cause of death and for understanding disease pathophysiology.
Recently, the interest in post mortem minimally invasive biopsies has grown
which is a less destructive approach in comparison to an open autopsy and
reduces the risk of infection. While manual biopsies under ultrasound guidance
are more widely performed, robotic post mortem biopsies have been recently
proposed. This approach can further reduce the risk of infection for
physicians. However, planning of the procedure and control of the robot need to
be efficient and usable. We explore a virtual reality setup with a digital twin
to realize fully remote planning and control of robotic post mortem biopsies.
The setup is evaluated with forensic pathologists in a usability study for
three interaction methods. Furthermore, we evaluate clinical feasibility and
evaluate the system with three human cadavers. Overall, 132 needle insertions
were performed with an off-axis needle placement error of 5.30+-3.25 mm. Tissue
samples were successfully biopsied and histopathologically verified. Users
reported a very intuitive needle placement approach, indicating that the system
is a promising, precise, and low-risk alternative to conventional approaches.","Maximilian Neidhardt, Ludwig Bosse, Vidas Raudonis, Kristina Allgoewer, Axel Heinemann, Benjamin Ondruschka, Alexander Schlaefer",2025-09-02 19:06:25+00:00,http://arxiv.org/abs/2509.02760v2,http://arxiv.org/pdf/2509.02760v2,cs.RO
The Impact of Adaptive Emotional Alignment on Mental State Attribution and User Empathy in HRI,"The paper presents an experiment on the effects of adaptive emotional
alignment between agents, considered a prerequisite for empathic communication,
in Human-Robot Interaction (HRI). Using the NAO robot, we investigate the
impact of an emotionally aligned, empathic, dialogue on these aspects: (i) the
robot's persuasive effectiveness, (ii) the user's communication style, and
(iii) the attribution of mental states and empathy to the robot. In an
experiment with 42 participants, two conditions were compared: one with neutral
communication and another where the robot provided responses adapted to the
emotions expressed by the users. The results show that emotional alignment does
not influence users' communication styles or have a persuasive effect. However,
it significantly influences attribution of mental states to the robot and its
perceived empathy","Giorgia Buracchio, Ariele Callegari, Massimo Donini, Cristina Gena, Antonio Lieto, Alberto Lillo, Claudio Mattutino, Alessandro Mazzei, Linda Pigureddu, Manuel Striani, Fabiana Vernero",2025-09-02 18:56:44+00:00,http://arxiv.org/abs/2509.02749v1,http://arxiv.org/pdf/2509.02749v1,cs.RO
Acrobotics: A Generalist Approahc To Quadrupedal Robots' Parkour,"Climbing, crouching, bridging gaps, and walking up stairs are just a few of
the advantages that quadruped robots have over wheeled robots, making them more
suitable for navigating rough and unstructured terrain. However, executing such
manoeuvres requires precise temporal coordination and complex agent-environment
interactions. Moreover, legged locomotion is inherently more prone to slippage
and tripping, and the classical approach of modeling such cases to design a
robust controller thus quickly becomes impractical. In contrast, reinforcement
learning offers a compelling solution by enabling optimal control through trial
and error. We present a generalist reinforcement learning algorithm for
quadrupedal agents in dynamic motion scenarios. The learned policy rivals
state-of-the-art specialist policies trained using a mixture of experts
approach, while using only 25% as many agents during training. Our experiments
also highlight the key components of the generalist locomotion policy and the
primary factors contributing to its success.","Guillaume Gagné-Labelle, Vassil Atanassov, Ioannis Havoutis",2025-09-02 18:23:17+00:00,http://arxiv.org/abs/2509.02727v1,http://arxiv.org/pdf/2509.02727v1,cs.RO
2nd Place Solution for CVPR2024 E2E Challenge: End-to-End Autonomous Driving Using Vision Language Model,"End-to-end autonomous driving has drawn tremendous attention recently. Many
works focus on using modular deep neural networks to construct the end-to-end
archi-tecture. However, whether using powerful large language models (LLM),
especially multi-modality Vision Language Models (VLM) could benefit the
end-to-end driving tasks remain a question. In our work, we demonstrate that
combining end-to-end architectural design and knowledgeable VLMs yield
impressive performance on the driving tasks. It is worth noting that our method
only uses a single camera and is the best camera-only solution across the
leaderboard, demonstrating the effectiveness of vision-based driving approach
and the potential for end-to-end driving tasks.","Zilong Guo, Yi Luo, Long Sha, Dongxu Wang, Panqu Wang, Chenyang Xu, Yi Yang",2025-09-02 17:52:29+00:00,http://arxiv.org/abs/2509.02659v1,http://arxiv.org/pdf/2509.02659v1,"cs.CV, cs.RO"
Manipulation as in Simulation: Enabling Accurate Geometry Perception in Robots,"Modern robotic manipulation primarily relies on visual observations in a 2D
color space for skill learning but suffers from poor generalization. In
contrast, humans, living in a 3D world, depend more on physical properties-such
as distance, size, and shape-than on texture when interacting with objects.
Since such 3D geometric information can be acquired from widely available depth
cameras, it appears feasible to endow robots with similar perceptual
capabilities. Our pilot study found that using depth cameras for manipulation
is challenging, primarily due to their limited accuracy and susceptibility to
various types of noise. In this work, we propose Camera Depth Models (CDMs) as
a simple plugin on daily-use depth cameras, which take RGB images and raw depth
signals as input and output denoised, accurate metric depth. To achieve this,
we develop a neural data engine that generates high-quality paired data from
simulation by modeling a depth camera's noise pattern. Our results show that
CDMs achieve nearly simulation-level accuracy in depth prediction, effectively
bridging the sim-to-real gap for manipulation tasks. Notably, our experiments
demonstrate, for the first time, that a policy trained on raw simulated depth,
without the need for adding noise or real-world fine-tuning, generalizes
seamlessly to real-world robots on two challenging long-horizon tasks involving
articulated, reflective, and slender objects, with little to no performance
degradation. We hope our findings will inspire future research in utilizing
simulation data and 3D information in general robot policies.","Minghuan Liu, Zhengbang Zhu, Xiaoshen Han, Peng Hu, Haotong Lin, Xinyao Li, Jingxiao Chen, Jiafeng Xu, Yichu Yang, Yunfeng Lin, Xinghang Li, Yong Yu, Weinan Zhang, Tao Kong, Bingyi Kang",2025-09-02 17:29:38+00:00,http://arxiv.org/abs/2509.02530v1,http://arxiv.org/pdf/2509.02530v1,"cs.RO, cs.AI, cs.CV"
Fault-tolerant Model Predictive Control for Spacecraft,"Given the cost and critical functions of satellite constellations, ensuring
mission longevity and safe decommissioning is essential for space
sustainability. This article presents a Model Predictive Control for spacecraft
trajectory and setpoint stabilization under multiple actuation failures. The
proposed solution allows us to efficiently control the faulty spacecraft
enabling safe navigation towards servicing or collision-free trajectories. The
proposed scheme ensures closed-loop asymptotic stability and is shown to be
recursively feasible. We demonstrate its efficacy through open-source numerical
results and realistic experiments using the ATMOS platform.","Raphael Stöckner, Pedro Roque, Maria Charitidou, Dimos V. Dimarogonas",2025-09-02 17:28:38+00:00,http://arxiv.org/abs/2509.02527v1,http://arxiv.org/pdf/2509.02527v1,cs.RO
