title,summary,authors,published,url,pdf_url,categories
Arnold: a generalist muscle transformer policy,"Controlling high-dimensional and nonlinear musculoskeletal models of the
human body is a foundational scientific challenge. Recent machine learning
breakthroughs have heralded policies that master individual skills like
reaching, object manipulation and locomotion in musculoskeletal systems with
many degrees of freedom. However, these agents are merely ""specialists"",
achieving high performance for a single skill. In this work, we develop Arnold,
a generalist policy that masters multiple tasks and embodiments. Arnold
combines behavior cloning and fine-tuning with PPO to achieve expert or
super-expert performance in 14 challenging control tasks from dexterous object
manipulation to locomotion. A key innovation is Arnold's sensorimotor
vocabulary, a compositional representation of the semantics of heterogeneous
sensory modalities, objectives, and actuators. Arnold leverages this vocabulary
via a transformer architecture to deal with the variable observation and action
spaces of each task. This framework supports efficient multi-task,
multi-embodiment learning and facilitates rapid adaptation to novel tasks.
Finally, we analyze Arnold to provide insights into biological motor control,
corroborating recent findings on the limited transferability of muscle
synergies across tasks.","Alberto Silvio Chiappa, Boshi An, Merkourios Simos, Chengkun Li, Alexander Mathis",2025-08-25 14:22:40+00:00,http://arxiv.org/abs/2508.18066v1,http://arxiv.org/pdf/2508.18066v1,"cs.RO, cs.AI, cs.LG, q-bio.QM"
Modeling and Control Framework for Autonomous Space Manipulator Handover Operations,"Autonomous space robotics is poised to play a vital role in future space
missions, particularly for In-space Servicing, Assembly, and Manufacturing
(ISAM). A key capability in such missions is the Robot-to-Robot (R2R) handover
of mission-critical objects. This work presents a dynamic model of a dual-arm
space manipulator system and compares various tracking control laws. The key
contributions of this work are the development of a cooperative manipulator
dynamic model and the comparative analysis of control laws to support
autonomous R2R handovers in ISAM scenarios.","Diego Quevedo, Sarah Hudson, Donghoon Kim",2025-08-25 13:56:36+00:00,http://arxiv.org/abs/2508.18039v1,http://arxiv.org/pdf/2508.18039v1,"cs.RO, cs.SY, eess.SY"
No Need to Look! Locating and Grasping Objects by a Robot Arm Covered with Sensitive Skin,"Locating and grasping of objects by robots is typically performed using
visual sensors. Haptic feedback from contacts with the environment is only
secondary if present at all. In this work, we explored an extreme case of
searching for and grasping objects in complete absence of visual input, relying
on haptic feedback only. The main novelty lies in the use of contacts over the
complete surface of a robot manipulator covered with sensitive skin. The search
is divided into two phases: (1) coarse workspace exploration with the complete
robot surface, followed by (2) precise localization using the end-effector
equipped with a force/torque sensor. We systematically evaluated this method in
simulation and on the real robot, demonstrating that diverse objects can be
located, grasped, and put in a basket. The overall success rate on the real
robot for one object was 85.7\% with failures mainly while grasping specific
objects. The method using whole-body contacts is six times faster compared to a
baseline that uses haptic feedback only on the end-effector. We also show
locating and grasping multiple objects on the table. This method is not
restricted to our specific setup and can be deployed on any platform with the
ability of sensing contacts over the entire body surface. This work holds
promise for diverse applications in areas with challenging visual perception
(due to lighting, dust, smoke, occlusion) such as in agriculture when fruits or
vegetables need to be located inside foliage and picked.","Karel Bartunek, Lukas Rustler, Matej Hoffmann",2025-08-25 12:55:38+00:00,http://arxiv.org/abs/2508.17986v1,http://arxiv.org/pdf/2508.17986v1,cs.RO
Integration of Computer Vision with Adaptive Control for Autonomous Driving Using ADORE,"Ensuring safety in autonomous driving requires a seamless integration of
perception and decision making under uncertain conditions. Although computer
vision (CV) models such as YOLO achieve high accuracy in detecting traffic
signs and obstacles, their performance degrades in drift scenarios caused by
weather variations or unseen objects. This work presents a simulated autonomous
driving system that combines a context aware CV model with adaptive control
using the ADORE framework. The CARLA simulator was integrated with ADORE via
the ROS bridge, allowing real-time communication between perception, decision,
and control modules. A simulated test case was designed in both clear and drift
weather conditions to demonstrate the robust detection performance of the
perception model while ADORE successfully adapted vehicle behavior to speed
limits and obstacles with low response latency. The findings highlight the
potential of coupling deep learning-based perception with rule-based adaptive
decision making to improve automotive safety critical system.","Abu Shad Ahammed, Md Shahi Amran Hossain, Sayeri Mukherjee, Roman Obermaisser, Md. Ziaur Rahman",2025-08-25 12:55:30+00:00,http://arxiv.org/abs/2508.17985v2,http://arxiv.org/pdf/2508.17985v2,cs.RO
Neural Algorithmic Reasoners informed Large Language Model for Multi-Agent Path Finding,"The development and application of large language models (LLM) have
demonstrated that foundational models can be utilized to solve a wide array of
tasks. However, their performance in multi-agent path finding (MAPF) tasks has
been less than satisfactory, with only a few studies exploring this area. MAPF
is a complex problem requiring both planning and multi-agent coordination. To
improve the performance of LLM in MAPF tasks, we propose a novel framework,
LLM-NAR, which leverages neural algorithmic reasoners (NAR) to inform LLM for
MAPF. LLM-NAR consists of three key components: an LLM for MAPF, a pre-trained
graph neural network-based NAR, and a cross-attention mechanism. This is the
first work to propose using a neural algorithmic reasoner to integrate GNNs
with the map information for MAPF, thereby guiding LLM to achieve superior
performance. LLM-NAR can be easily adapted to various LLM models. Both
simulation and real-world experiments demonstrate that our method significantly
outperforms existing LLM-based approaches in solving MAPF problems.","Pu Feng, Size Wang, Yuhong Cao, Junkang Liang, Rongye Shi, Wenjun Wu",2025-08-25 12:38:08+00:00,http://arxiv.org/abs/2508.17971v1,http://arxiv.org/pdf/2508.17971v1,"cs.AI, cs.RO"
A holistic perception system of internal and external monitoring for ground autonomous vehicles: AutoTRUST paradigm,"This paper introduces a holistic perception system for internal and external
monitoring of autonomous vehicles, with the aim of demonstrating a novel
AI-leveraged self-adaptive framework of advanced vehicle technologies and
solutions that optimize perception and experience on-board. Internal monitoring
system relies on a multi-camera setup designed for predicting and identifying
driver and occupant behavior through facial recognition, exploiting in addition
a large language model as virtual assistant. Moreover, the in-cabin monitoring
system includes AI-empowered smart sensors that measure air-quality and perform
thermal comfort analysis for efficient on and off-boarding. On the other hand,
external monitoring system perceives the surrounding environment of vehicle,
through a LiDAR-based cost-efficient semantic segmentation approach, that
performs highly accurate and efficient super-resolution on low-quality raw 3D
point clouds. The holistic perception framework is developed in the context of
EU's Horizon Europe programm AutoTRUST, and has been integrated and deployed on
a real electric vehicle provided by ALKE. Experimental validation and
evaluation at the integration site of Joint Research Centre at Ispra, Italy,
highlights increased performance and efficiency of the modular blocks of the
proposed perception architecture.","Alexandros Gkillas, Christos Anagnostopoulos, Nikos Piperigkos, Dimitris Tsiktsiris, Theofilos Christodoulou, Theofanis Siamatras, Dimitrios Triantafyllou, Christos Basdekis, Theoktisti Marinopoulou, Panagiotis Lepentsiotis, Elefterios Blitsis, Aggeliki Zacharaki, Nearchos Stylianidis, Leonidas Katelaris, Lamberto Salvan, Aris S. Lalos, Christos Laoudias, Antonios Lalas, Konstantinos Votis",2025-08-25 12:32:13+00:00,http://arxiv.org/abs/2508.17969v1,http://arxiv.org/pdf/2508.17969v1,"cs.RO, cs.CV"
Egocentric Instruction-oriented Affordance Prediction via Large Multimodal Model,"Affordance is crucial for intelligent robots in the context of object
manipulation. In this paper, we argue that affordance should be
task-/instruction-dependent, which is overlooked by many previous works. That
is, different instructions can lead to different manipulation regions and
directions even for the same object. According to this observation, we present
a new dataset comprising fifteen thousand object-instruction-affordance
triplets. All scenes in the dataset are from an egocentric viewpoint, designed
to approximate the perspective of a human-like robot. Furthermore, we
investigate how to enable large multimodal models (LMMs) to serve as affordance
predictors by implementing a ``search against verifiers'' pipeline. An LMM is
asked to progressively predict affordances, with the output at each step being
verified by itself during the iterative process, imitating a reasoning process.
Experiments show that our method not only unlocks new instruction-oriented
affordance prediction capabilities, but also achieves outstanding performance
broadly.","Bokai Ji, Jie Gu, Xiaokang Ma, Chu Tang, Jingmin Chen, Guangxia Li",2025-08-25 11:40:31+00:00,http://arxiv.org/abs/2508.17922v1,http://arxiv.org/pdf/2508.17922v1,"cs.RO, cs.CV"
Physical Embodiment Enables Information Processing Beyond Explicit Sensing in Active Matter,"Living microorganisms have evolved dedicated sensory machinery to detect
environmental perturbations, processing these signals through biochemical
networks to guide behavior. Replicating such capabilities in synthetic active
matter remains a fundamental challenge. Here, we demonstrate that synthetic
active particles can adapt to hidden hydrodynamic perturbations through
physical embodiment alone, without explicit sensing mechanisms. Using
reinforcement learning to control self-thermophoretic particles, we show that
they learn navigation strategies to counteract unobserved flow fields by
exploiting information encoded in their physical dynamics. Remarkably,
particles successfully navigate perturbations that are not included in their
state inputs, revealing that embodied dynamics can serve as an implicit sensing
mechanism. This discovery establishes physical embodiment as a computational
resource for information processing in active matter, with implications for
autonomous microrobotic systems and bio-inspired computation.","Diptabrata Paul, Nikola Milosevic, Nico Scherf, Frank Cichos",2025-08-25 11:39:36+00:00,http://arxiv.org/abs/2508.17921v1,http://arxiv.org/pdf/2508.17921v1,"cond-mat.soft, cs.RO"
CubeDN: Real-time Drone Detection in 3D Space from Dual mmWave Radar Cubes,"As drone use has become more widespread, there is a critical need to ensure
safety and security. A key element of this is robust and accurate drone
detection and localization. While cameras and other optical sensors like LiDAR
are commonly used for object detection, their performance degrades under
adverse lighting and environmental conditions. Therefore, this has generated
interest in finding more reliable alternatives, such as millimeter-wave
(mmWave) radar. Recent research on mmWave radar object detection has
predominantly focused on 2D detection of road users. Although these systems
demonstrate excellent performance for 2D problems, they lack the sensing
capability to measure elevation, which is essential for 3D drone detection. To
address this gap, we propose CubeDN, a single-stage end-to-end radar object
detection network specifically designed for flying drones. CubeDN overcomes
challenges such as poor elevation resolution by utilizing a dual radar
configuration and a novel deep learning pipeline. It simultaneously detects,
localizes, and classifies drones of two sizes, achieving decimeter-level
tracking accuracy at closer ranges with overall $95\%$ average precision (AP)
and $85\%$ average recall (AR). Furthermore, CubeDN completes data processing
and inference at 10Hz, making it highly suitable for practical applications.","Yuan Fang, Fangzhan Shi, Xijia Wei, Qingchao Chen, Kevin Chetty, Simon Julier",2025-08-25 09:32:15+00:00,http://arxiv.org/abs/2508.17831v1,http://arxiv.org/pdf/2508.17831v1,cs.RO
Effect of Performance Feedback Timing on Motor Learning for a Surgical Training Task,"Objective: Robot-assisted minimally invasive surgery (RMIS) has become the
gold standard for a variety of surgical procedures, but the optimal method of
training surgeons for RMIS is unknown. We hypothesized that real-time, rather
than post-task, error feedback would better increase learning speed and reduce
errors. Methods: Forty-two surgical novices learned a virtual version of the
ring-on-wire task, a canonical task in RMIS training. We investigated the
impact of feedback timing with multi-sensory (haptic and visual) cues in three
groups: (1) real-time error feedback, (2) trial replay with error feedback, and
(3) no error feedback. Results: Participant performance was evaluated based on
the accuracy of ring position and orientation during the task. Participants who
received real-time feedback outperformed other groups in ring orientation.
Additionally, participants who received feedback in replay outperformed
participants who did not receive any error feedback on ring orientation during
long, straight path sections. There were no significant differences between
groups for ring position overall, but participants who received real-time
feedback outperformed the other groups in positional accuracy on tightly curved
path sections. Conclusion: The addition of real-time haptic and visual error
feedback improves learning outcomes in a virtual surgical task over error
feedback in replay or no error feedback at all. Significance: This work
demonstrates that multi-sensory error feedback delivered in real time leads to
better training outcomes as compared to the same feedback delivered after task
completion. This novel method of training may enable surgical trainees to
develop skills with greater speed and accuracy.","Mary Kate Gale, Kailana Baker-Matsuoka, Ilana Nisky, Allison Okamura",2025-08-25 09:30:17+00:00,http://arxiv.org/abs/2508.17830v1,http://arxiv.org/pdf/2508.17830v1,cs.RO
Adaptive Output Steps: FlexiSteps Network for Dynamic Trajectory Prediction,"Accurate trajectory prediction is vital for autonomous driving, robotics, and
intelligent decision-making systems, yet traditional models typically rely on
fixed-length output predictions, limiting their adaptability to dynamic
real-world scenarios. In this paper, we introduce the FlexiSteps Network (FSN),
a novel framework that dynamically adjusts prediction output time steps based
on varying contextual conditions. Inspired by recent advancements addressing
observation length discrepancies and dynamic feature extraction, FSN
incorporates an pre-trained Adaptive Prediction Module (APM) to evaluate and
adjust the output steps dynamically, ensuring optimal prediction accuracy and
efficiency. To guarantee the plug-and-play of our FSN, we also design a Dynamic
Decoder(DD). Additionally, to balance the prediction time steps and prediction
accuracy, we design a scoring mechanism, which not only introduces the
Fr\'echet distance to evaluate the geometric similarity between the predicted
trajectories and the ground truth trajectories but the length of predicted
steps is also considered. Extensive experiments conducted on benchmark datasets
including Argoverse and INTERACTION demonstrate the effectiveness and
flexibility of our proposed FSN framework.","Yunxiang Liu, Hongkuo Niu, Jianlin Zhu",2025-08-25 08:43:08+00:00,http://arxiv.org/abs/2508.17797v1,http://arxiv.org/pdf/2508.17797v1,"cs.RO, cs.AI"
Talking to Robots: A Practical Examination of Speech Foundation Models for HRI Applications,"Automatic Speech Recognition (ASR) systems in real-world settings need to
handle imperfect audio, often degraded by hardware limitations or environmental
noise, while accommodating diverse user groups. In human-robot interaction
(HRI), these challenges intersect to create a uniquely challenging recognition
environment. We evaluate four state-of-the-art ASR systems on eight publicly
available datasets that capture six dimensions of difficulty: domain-specific,
accented, noisy, age-variant, impaired, and spontaneous speech. Our analysis
demonstrates significant variations in performance, hallucination tendencies,
and inherent biases, despite similar scores on standard benchmarks. These
limitations have serious implications for HRI, where recognition errors can
interfere with task performance, user trust, and safety.","Theresa Pekarek Rosin, Julia Gachot, Henri-Leon Kordt, Matthias Kerzel, Stefan Wermter",2025-08-25 07:45:20+00:00,http://arxiv.org/abs/2508.17753v1,http://arxiv.org/pdf/2508.17753v1,"cs.RO, cs.AI, cs.CL, cs.HC"
U2UData-2: A Scalable Swarm UAVs Autonomous Flight Dataset for Long-horizon Tasks,"Swarm UAV autonomous flight for Long-Horizon (LH) tasks is crucial for
advancing the low-altitude economy. However, existing methods focus only on
specific basic tasks due to dataset limitations, failing in real-world
deployment for LH tasks. LH tasks are not mere concatenations of basic tasks,
requiring handling long-term dependencies, maintaining persistent states, and
adapting to dynamic goal shifts. This paper presents U2UData-2, the first
large-scale swarm UAV autonomous flight dataset for LH tasks and the first
scalable swarm UAV data online collection and algorithm closed-loop
verification platform. The dataset is captured by 15 UAVs in autonomous
collaborative flights for LH tasks, comprising 12 scenes, 720 traces, 120
hours, 600 seconds per trajectory, 4.32M LiDAR frames, and 12.96M RGB frames.
This dataset also includes brightness, temperature, humidity, smoke, and
airflow values covering all flight routes. The platform supports the
customization of simulators, UAVs, sensors, flight algorithms, formation modes,
and LH tasks. Through a visual control window, this platform allows users to
collect customized datasets through one-click deployment online and to verify
algorithms by closed-loop simulation. U2UData-2 also introduces an LH task for
wildlife conservation and provides comprehensive benchmarks with 9 SOTA models.
U2UData-2 can be found at https://fengtt42.github.io/U2UData-2/.","Tongtong Feng, Xin Wang, Feilin Han, Leping Zhang, Wenwu Zhu",2025-08-25 07:39:36+00:00,http://arxiv.org/abs/2509.00055v1,http://arxiv.org/pdf/2509.00055v1,"cs.RO, cs.AI, cs.MA, cs.MM"
Robotic Fire Risk Detection based on Dynamic Knowledge Graph Reasoning: An LLM-Driven Approach with Graph Chain-of-Thought,"Fire is a highly destructive disaster, but effective prevention can
significantly reduce its likelihood of occurrence. When it happens, deploying
emergency robots in fire-risk scenarios can help minimize the danger to human
responders. However, current research on pre-disaster warnings and
disaster-time rescue still faces significant challenges due to incomplete
perception, inadequate fire situational awareness, and delayed response. To
enhance intelligent perception and response planning for robots in fire
scenarios, we first construct a knowledge graph (KG) by leveraging large
language models (LLMs) to integrate fire domain knowledge derived from fire
prevention guidelines and fire rescue task information from robotic emergency
response documents. We then propose a new framework called Insights-on-Graph
(IOG), which integrates the structured fire information of KG and Large
Multimodal Models (LMMs). The framework generates perception-driven risk graphs
from real-time scene imagery to enable early fire risk detection and provide
interpretable emergency responses for task module and robot component
configuration based on the evolving risk situation. Extensive simulations and
real-world experiments show that IOG has good applicability and practical
application value in fire risk detection and rescue decision-making.","Haimei Pan, Jiyun Zhang, Qinxi Wei, Xiongnan Jin, Chen Xinkai, Jie Cheng",2025-08-25 07:10:16+00:00,http://arxiv.org/abs/2509.00054v2,http://arxiv.org/pdf/2509.00054v2,"cs.RO, cs.AI"
MEVITA: Open-Source Bipedal Robot Assembled from E-Commerce Components via Sheet Metal Welding,"Various bipedal robots have been developed to date, and in recent years,
there has been a growing trend toward releasing these robots as open-source
platforms. This shift is fostering an environment in which anyone can freely
develop bipedal robots and share their knowledge, rather than relying solely on
commercial products. However, most existing open-source bipedal robots are
designed to be fabricated using 3D printers, which limits their scalability in
size and often results in fragile structures. On the other hand, some
metal-based bipedal robots have been developed, but they typically involve a
large number of components, making assembly difficult, and in some cases, the
parts themselves are not readily available through e-commerce platforms. To
address these issues, we developed MEVITA, an open-source bipedal robot that
can be built entirely from components available via e-commerce. Aiming for the
minimal viable configuration for a bipedal robot, we utilized sheet metal
welding to integrate complex geometries into single parts, thereby
significantly reducing the number of components and enabling easy assembly for
anyone. Through reinforcement learning in simulation and Sim-to-Real transfer,
we demonstrated robust walking behaviors across various environments,
confirming the effectiveness of our approach. All hardware, software, and
training environments can be obtained from https://github.com/haraduka/mevita .","Kento Kawaharazuka, Shogo Sawaguchi, Ayumu Iwata, Keita Yoneda, Temma Suzuki, Kei Okada",2025-08-25 05:41:53+00:00,http://arxiv.org/abs/2508.17684v1,http://arxiv.org/pdf/2508.17684v1,cs.RO
SEBVS: Synthetic Event-based Visual Servoing for Robot Navigation and Manipulation,"Event cameras offer microsecond latency, high dynamic range, and low power
consumption, making them ideal for real-time robotic perception under
challenging conditions such as motion blur, occlusion, and illumination
changes. However, despite their advantages, synthetic event-based vision
remains largely unexplored in mainstream robotics simulators. This lack of
simulation setup hinders the evaluation of event-driven approaches for robotic
manipulation and navigation tasks. This work presents an open-source,
user-friendly v2e robotics operating system (ROS) package for Gazebo simulation
that enables seamless event stream generation from RGB camera feeds. The
package is used to investigate event-based robotic policies (ERP) for real-time
navigation and manipulation. Two representative scenarios are evaluated: (1)
object following with a mobile robot and (2) object detection and grasping with
a robotic manipulator. Transformer-based ERPs are trained by behavior cloning
and compared to RGB-based counterparts under various operating conditions.
Experimental results show that event-guided policies consistently deliver
competitive advantages. The results highlight the potential of event-driven
perception to improve real-time robotic navigation and manipulation, providing
a foundation for broader integration of event cameras into robotic policy
learning. The GitHub repo for the dataset and code:
https://eventbasedvision.github.io/SEBVS/","Krishna Vinod, Prithvi Jai Ramesh, Pavan Kumar B N, Bharatesh Chakravarthi",2025-08-25 04:14:04+00:00,http://arxiv.org/abs/2508.17643v1,http://arxiv.org/pdf/2508.17643v1,"cs.RO, cs.CV"
