title,summary,authors,published,url,pdf_url,categories
Robust Real-Time Coordination of CAVs: A Distributed Optimization Framework under Uncertainty,"Achieving both safety guarantees and real-time performance in cooperative
vehicle coordination remains a fundamental challenge, particularly in dynamic
and uncertain environments. This paper presents a novel coordination framework
that resolves this challenge through three key innovations: 1) direct control
of vehicles' trajectory distributions during coordination, formulated as a
robust cooperative planning problem with adaptive enhanced safety constraints,
ensuring a specified level of safety regarding the uncertainty of the
interactive trajectory, 2) a fully parallel ADMM-based distributed trajectory
negotiation (ADMM-DTN) algorithm that efficiently solves the optimization
problem while allowing configurable negotiation rounds to balance solution
quality and computational resources, and 3) an interactive attention mechanism
that selectively focuses on critical interactive participants to further
enhance computational efficiency. Both simulation results and practical
experiments demonstrate that our framework achieves significant advantages in
safety (reducing collision rates by up to 40.79\% in various scenarios) and
real-time performance compared to state-of-the-art methods, while maintaining
strong scalability with increasing vehicle numbers. The proposed interactive
attention mechanism further reduces the computational demand by 14.1\%. The
framework's effectiveness is further validated through real-world experiments
with unexpected dynamic obstacles, demonstrating robust coordination in complex
environments. The experiment demo could be found at
https://youtu.be/4PZwBnCsb6Q.","Haojie Bai, Yang Wang, Cong Guo, Xiongwei Zhao, Hai Zhu",2025-08-29 04:24:49+00:00,http://arxiv.org/abs/2508.21322v1,http://arxiv.org/pdf/2508.21322v1,cs.RO
Cooperative Sensing Enhanced UAV Path-Following and Obstacle Avoidance with Variable Formation,"The high mobility of unmanned aerial vehicles (UAVs) enables them to be used
in various civilian fields, such as rescue and cargo transport. Path-following
is a crucial way to perform these tasks while sensing and collision avoidance
are essential for safe flight. In this paper, we investigate how to efficiently
and accurately achieve path-following, obstacle sensing and avoidance subtasks,
as well as their conflict-free fusion scheduling. Firstly, a high precision
deep reinforcement learning (DRL)-based UAV formation path-following model is
developed, and the reward function with adaptive weights is designed from the
perspective of distance and velocity errors. Then, we use integrated sensing
and communication (ISAC) signals to detect the obstacle and derive the
Cramer-Rao lower bound (CRLB) for obstacle sensing by information-level fusion,
based on which we propose the variable formation enhanced obstacle position
estimation (VFEO) algorithm. In addition, an online obstacle avoidance scheme
without pretraining is designed to solve the sparse reward. Finally, with the
aid of null space based (NSB) behavioral method, we present a hierarchical
subtasks fusion strategy. Simulation results demonstrate the effectiveness and
superiority of the subtask algorithms and the hierarchical fusion strategy.","Changheng Wang, Zhiqing Wei, Wangjun Jiang, Haoyue Jiang, Zhiyong Feng",2025-08-29 02:48:41+00:00,http://arxiv.org/abs/2508.21316v1,http://arxiv.org/pdf/2508.21316v1,"eess.SY, cs.RO, cs.SY"
Observability-driven Assignment of Heterogeneous Sensors for Multi-Target Tracking,"This paper addresses the challenge of assigning heterogeneous sensors (i.e.,
robots with varying sensing capabilities) for multi-target tracking. We
classify robots into two categories: (1) sufficient sensing robots, equipped
with range and bearing sensors, capable of independently tracking targets, and
(2) limited sensing robots, which are equipped with only range or bearing
sensors and need to at least form a pair to collaboratively track a target. Our
objective is to optimize tracking quality by minimizing uncertainty in target
state estimation through efficient robot-to-target assignment. By leveraging
matroid theory, we propose a greedy assignment algorithm that dynamically
allocates robots to targets to maximize tracking quality. The algorithm
guarantees constant-factor approximation bounds of 1/3 for arbitrary tracking
quality functions and 1/2 for submodular functions, while maintaining
polynomial-time complexity. Extensive simulations demonstrate the algorithm's
effectiveness in accurately estimating and tracking targets over extended
periods. Furthermore, numerical results confirm that the algorithm's
performance is close to that of the optimal assignment, highlighting its
robustness and practical applicability.","Seyed Ali Rakhshan, Mehdi Golestani, He Kong",2025-08-29 02:22:29+00:00,http://arxiv.org/abs/2508.21309v1,http://arxiv.org/pdf/2508.21309v1,cs.RO
Detecting Domain Shifts in Myoelectric Activations: Challenges and Opportunities in Stream Learning,"Detecting domain shifts in myoelectric activations poses a significant
challenge due to the inherent non-stationarity of electromyography (EMG)
signals. This paper explores the detection of domain shifts using data stream
(DS) learning techniques, focusing on the DB6 dataset from the Ninapro
database. We define domains as distinct time-series segments based on different
subjects and recording sessions, applying Kernel Principal Component Analysis
(KPCA) with a cosine kernel to pre-process and highlight these shifts. By
evaluating multiple drift detection methods such as CUSUM, Page-Hinckley, and
ADWIN, we reveal the limitations of current techniques in achieving high
performance for real-time domain shift detection in EMG signals. Our results
underscore the potential of streaming-based approaches for maintaining stable
EMG decoding models, while highlighting areas for further research to enhance
robustness and accuracy in real-world scenarios.","Yibin Sun, Nick Lim, Guilherme Weigert Cassales, Heitor Murilo Gomes, Bernhard Pfahringer, Albert Bifet, Anany Dwivedi",2025-08-29 00:47:28+00:00,http://arxiv.org/abs/2508.21278v1,http://arxiv.org/pdf/2508.21278v1,"cs.LG, cs.RO"
Learning to Assemble the Soma Cube with Legal-Action Masked DQN and Safe ZYZ Regrasp on a Doosan M0609,"This paper presents the first comprehensive application of legal-action
masked Deep Q-Networks with safe ZYZ regrasp strategies to an underactuated
gripper-equipped 6-DOF collaborative robot for autonomous Soma cube assembly
learning. Our approach represents the first systematic integration of
constraint-aware reinforcement learning with singularity-safe motion planning
on a Doosan M0609 collaborative robot. We address critical challenges in
robotic manipulation: combinatorial action space explosion, unsafe motion
planning, and systematic assembly strategy learning. Our system integrates a
legal-action masked DQN with hierarchical architecture that decomposes
Q-function estimation into orientation and position components, reducing
computational complexity from $O(3,132)$ to $O(116) + O(27)$ while maintaining
solution completeness. The robot-friendly reward function encourages
ground-first, vertically accessible assembly sequences aligned with
manipulation constraints. Curriculum learning across three progressive
difficulty levels (2-piece, 3-piece, 7-piece) achieves remarkable training
efficiency: 100\% success rate for Level 1 within 500 episodes, 92.9\% for
Level 2, and 39.9\% for Level 3 over 105,300 total training episodes.","Jaehong Oh, Seungjun Jung, Sawoong Kim",2025-08-29 00:27:03+00:00,http://arxiv.org/abs/2508.21272v1,http://arxiv.org/pdf/2508.21272v1,"cs.RO, stat.CO"
Mini Autonomous Car Driving based on 3D Convolutional Neural Networks,"Autonomous driving applications have become increasingly relevant in the
automotive industry due to their potential to enhance vehicle safety,
efficiency, and user experience, thereby meeting the growing demand for
sophisticated driving assistance features. However, the development of reliable
and trustworthy autonomous systems poses challenges such as high complexity,
prolonged training periods, and intrinsic levels of uncertainty. Mini
Autonomous Cars (MACs) are used as a practical testbed, enabling validation of
autonomous control methodologies on small-scale setups. This simplified and
cost-effective environment facilitates rapid evaluation and comparison of
machine learning models, which is particularly useful for algorithms requiring
online training. To address these challenges, this work presents a methodology
based on RGB-D information and three-dimensional convolutional neural networks
(3D CNNs) for MAC autonomous driving in simulated environments. We evaluate the
proposed approach against recurrent neural networks (RNNs), with architectures
trained and tested on two simulated tracks with distinct environmental
features. Performance was assessed using task completion success, lap-time
metrics, and driving consistency. Results highlight how architectural
modifications and track complexity influence the models' generalization
capability and vehicle control performance. The proposed 3D CNN demonstrated
promising results when compared with RNNs.","Pablo Moraes, Monica Rodriguez, Kristofer S. Kappel, Hiago Sodre, Santiago Fernandez, Igor Nunes, Bruna Guterres, Ricardo Grando",2025-08-29 00:21:34+00:00,http://arxiv.org/abs/2508.21271v1,http://arxiv.org/pdf/2508.21271v1,"cs.RO, cs.CV"
Remarks on stochastic cloning and delayed-state filtering,"Many estimation problems in robotics and navigation involve measurements that
depend on prior states. A prominent example is odometry, which measures the
relative change between states over time. Accurately handling these
delayed-state measurements requires capturing their correlations with prior
state estimates, and a widely used approach is stochastic cloning (SC), which
augments the state vector to account for these correlations.
  This work revisits a long-established but often overlooked alternative--the
delayed-state Kalman filter--and demonstrates that a properly derived filter
yields exactly the same state and covariance update as SC, without requiring
state augmentation. Moreover, the generalized Kalman filter formulation
provides computational advantages, while also reducing memory requirements for
higher-dimensional states.
  Our findings clarify a common misconception that Kalman filter variants are
inherently unable to handle correlated delayed-state measurements,
demonstrating that an alternative formulation achieves the same results more
efficiently.","Tara Mina, Lindsey Marinello, John Christian",2025-08-28 23:17:42+00:00,http://arxiv.org/abs/2508.21260v1,http://arxiv.org/pdf/2508.21260v1,"cs.RO, eess.SP, math.ST, stat.TH"
Uncertainty-Aware Ankle Exoskeleton Control,"Lower limb exoskeletons show promise to assist human movement, but their
utility is limited by controllers designed for discrete, predefined actions in
controlled environments, restricting their real-world applicability. We present
an uncertainty-aware control framework that enables ankle exoskeletons to
operate safely across diverse scenarios by automatically disengaging when
encountering unfamiliar movements. Our approach uses an uncertainty estimator
to classify movements as similar (in-distribution) or different
(out-of-distribution) relative to actions in the training set. We evaluated
three architectures (model ensembles, autoencoders, and generative adversarial
networks) on an offline dataset and tested the strongest performing
architecture (ensemble of gait phase estimators) online. The online test
demonstrated the ability of our uncertainty estimator to turn assistance on and
off as the user transitioned between in-distribution and out-of-distribution
tasks (F1: 89.2). This new framework provides a path for exoskeletons to safely
and autonomously support human movement in unstructured, everyday environments.","Fatima Mumtaza Tourk, Bishoy Galoaa, Sanat Shajan, Aaron J. Young, Michael Everett, Max K. Shepherd",2025-08-28 21:24:04+00:00,http://arxiv.org/abs/2508.21221v1,http://arxiv.org/pdf/2508.21221v1,cs.RO
Multi-robot Path Planning and Scheduling via Model Predictive Optimal Transport (MPC-OT),"In this paper, we propose a novel methodology for path planning and
scheduling for multi-robot navigation that is based on optimal transport theory
and model predictive control. We consider a setup where $N$ robots are tasked
to navigate to $M$ targets in a common space with obstacles. Mapping robots to
targets first and then planning paths can result in overlapping paths that lead
to deadlocks. We derive a strategy based on optimal transport that not only
provides minimum cost paths from robots to targets but also guarantees
non-overlapping trajectories. We achieve this by discretizing the space of
interest into $K$ cells and by imposing a ${K\times K}$ cost structure that
describes the cost of transitioning from one cell to another. Optimal transport
then provides \textit{optimal and non-overlapping} cell transitions for the
robots to reach the targets that can be readily deployed without any scheduling
considerations. The proposed solution requires $\unicode{x1D4AA}(K^3\log K)$
computations in the worst-case and $\unicode{x1D4AA}(K^2\log K)$ for
well-behaved problems. To further accommodate potentially overlapping
trajectories (unavoidable in certain situations) as well as robot dynamics, we
show that a temporal structure can be integrated into optimal transport with
the help of \textit{replans} and \textit{model predictive control}.","Usman A. Khan, Mouhacine Benosman, Wenliang Liu, Federico Pecora, Joseph W. Durham",2025-08-28 20:47:33+00:00,http://arxiv.org/abs/2508.21205v1,http://arxiv.org/pdf/2508.21205v1,"cs.RO, cs.LG"
Observer Design for Optical Flow-Based Visual-Inertial Odometry with Almost-Global Convergence,"This paper presents a novel cascaded observer architecture that combines
optical flow and IMU measurements to perform continuous monocular
visual-inertial odometry (VIO). The proposed solution estimates body-frame
velocity and gravity direction simultaneously by fusing velocity direction
information from optical flow measurements with gyro and accelerometer data.
This fusion is achieved using a globally exponentially stable Riccati observer,
which operates under persistently exciting translational motion conditions. The
estimated gravity direction in the body frame is then employed, along with an
optional magnetometer measurement, to design a complementary observer on
$\mathbf{SO}(3)$ for attitude estimation. The resulting interconnected observer
architecture is shown to be almost globally asymptotically stable. To extract
the velocity direction from sparse optical flow data, a gradient descent
algorithm is developed to solve a constrained minimization problem on the unit
sphere. The effectiveness of the proposed algorithms is validated through
simulation results.","Tarek Bouazza, Soulaimane Berkane, Minh-Duc Hua, Tarek Hamel",2025-08-28 18:55:16+00:00,http://arxiv.org/abs/2508.21163v1,http://arxiv.org/pdf/2508.21163v1,"cs.RO, cs.SY, eess.SY"
A Comparative Study of Spline-Based Trajectory Reconstruction Methods Across Varying Automatic Vehicle Location Data Densities,"Automatic vehicle location (AVL) data offers insights into transit dynamics,
but its effectiveness is often hampered by inconsistent update frequencies,
necessitating trajectory reconstruction. This research evaluates 13 trajectory
reconstruction methods, including several novel approaches, using
high-resolution AVL data from Austin, Texas. We examine the interplay of four
critical factors -- velocity, position, smoothing, and data density -- on
reconstruction performance. A key contribution of this study is evaluation of
these methods across sparse and dense datasets, providing insights into the
trade-off between accuracy and resource allocation. Our evaluation framework
combines traditional mathematical error metrics for positional and velocity
with practical considerations, such as physical realism (e.g., aligning
velocity and acceleration with stopped states, deceleration rates, and speed
variability). In addition, we provide insight into the relative value of each
method in calculating realistic metrics for infrastructure evaluations. Our
findings indicate that velocity-aware methods consistently outperform
position-only approaches. Interestingly, we discovered that smoothing-based
methods can degrade overall performance in complex, congested urban
environments, although enforcing monotonicity remains critical. The velocity
constrained Hermite interpolation with monotonicity enforcement (VCHIP-ME)
yields optimal results, offering a balance between high accuracy and
computational efficiency. Its minimal overhead makes it suitable for both
historical analysis and real-time applications, providing significant
predictive power when combined with dense datasets. These findings offer
practical guidance for researchers and practitioners implementing trajectory
reconstruction systems and emphasize the importance of investing in
higher-frequency AVL data collection for improved analysis.","Jake Robbennolt, Sirajum Munira, Stephen D. Boyles",2025-08-28 18:45:29+00:00,http://arxiv.org/abs/2509.00119v1,http://arxiv.org/pdf/2509.00119v1,cs.RO
Learning on the Fly: Rapid Policy Adaptation via Differentiable Simulation,"Learning control policies in simulation enables rapid, safe, and
cost-effective development of advanced robotic capabilities. However,
transferring these policies to the real world remains difficult due to the
sim-to-real gap, where unmodeled dynamics and environmental disturbances can
degrade policy performance. Existing approaches, such as domain randomization
and Real2Sim2Real pipelines, can improve policy robustness, but either struggle
under out-of-distribution conditions or require costly offline retraining. In
this work, we approach these problems from a different perspective. Instead of
relying on diverse training conditions before deployment, we focus on rapidly
adapting the learned policy in the real world in an online fashion. To achieve
this, we propose a novel online adaptive learning framework that unifies
residual dynamics learning with real-time policy adaptation inside a
differentiable simulation. Starting from a simple dynamics model, our framework
refines the model continuously with real-world data to capture unmodeled
effects and disturbances such as payload changes and wind. The refined dynamics
model is embedded in a differentiable simulation framework, enabling gradient
backpropagation through the dynamics and thus rapid, sample-efficient policy
updates beyond the reach of classical RL methods like PPO. All components of
our system are designed for rapid adaptation, enabling the policy to adjust to
unseen disturbances within 5 seconds of training. We validate the approach on
agile quadrotor control under various disturbances in both simulation and the
real world. Our framework reduces hovering error by up to 81% compared to
L1-MPC and 55% compared to DATT, while also demonstrating robustness in
vision-based control without explicit state estimation.","Jiahe Pan, Jiaxu Xing, Rudolf Reiter, Yifan Zhai, Elie Aljalbout, Davide Scaramuzza",2025-08-28 17:59:34+00:00,http://arxiv.org/abs/2508.21065v1,http://arxiv.org/pdf/2508.21065v1,cs.RO
Embodied AI: Emerging Risks and Opportunities for Policy Action,"The field of embodied AI (EAI) is rapidly advancing. Unlike virtual AI, EAI
systems can exist in, learn from, reason about, and act in the physical world.
With recent advances in AI models and hardware, EAI systems are becoming
increasingly capable across wider operational domains. While EAI systems can
offer many benefits, they also pose significant risks, including physical harm
from malicious use, mass surveillance, as well as economic and societal
disruption. These risks require urgent attention from policymakers, as existing
policies governing industrial robots and autonomous vehicles are insufficient
to address the full range of concerns EAI systems present. To help address this
issue, this paper makes three contributions. First, we provide a taxonomy of
the physical, informational, economic, and social risks EAI systems pose.
Second, we analyze policies in the US, EU, and UK to assess how existing
frameworks address these risks and to identify critical gaps. We conclude by
offering policy recommendations for the safe and beneficial deployment of EAI
systems, such as mandatory testing and certification schemes, clarified
liability frameworks, and strategies to manage EAI's potentially transformative
economic and societal impacts.","Jared Perlo, Alexander Robey, Fazl Barez, Luciano Floridi, Jakob Mökander",2025-08-28 17:59:07+00:00,http://arxiv.org/abs/2509.00117v2,http://arxiv.org/pdf/2509.00117v2,"cs.CY, cs.AI, cs.RO"
Prompt-to-Product: Generative Assembly via Bimanual Manipulation,"Creating assembly products demands significant manual effort and expert
knowledge in 1) designing the assembly and 2) constructing the product. This
paper introduces Prompt-to-Product, an automated pipeline that generates
real-world assembly products from natural language prompts. Specifically, we
leverage LEGO bricks as the assembly platform and automate the process of
creating brick assembly structures. Given the user design requirements,
Prompt-to-Product generates physically buildable brick designs, and then
leverages a bimanual robotic system to construct the real assembly products,
bringing user imaginations into the real world. We conduct a comprehensive user
study, and the results demonstrate that Prompt-to-Product significantly lowers
the barrier and reduces manual effort in creating assembly products from
imaginative ideas.","Ruixuan Liu, Philip Huang, Ava Pun, Kangle Deng, Shobhit Aggarwal, Kevin Tang, Michelle Liu, Deva Ramanan, Jun-Yan Zhu, Jiaoyang Li, Changliu Liu",2025-08-28 17:59:05+00:00,http://arxiv.org/abs/2508.21063v1,http://arxiv.org/pdf/2508.21063v1,"cs.RO, cs.AI"
CogVLA: Cognition-Aligned Vision-Language-Action Model via Instruction-Driven Routing & Sparsification,"Recent Vision-Language-Action (VLA) models built on pre-trained
Vision-Language Models (VLMs) require extensive post-training, resulting in
high computational overhead that limits scalability and deployment.We propose
CogVLA, a Cognition-Aligned Vision-Language-Action framework that leverages
instruction-driven routing and sparsification to improve both efficiency and
performance. CogVLA draws inspiration from human multimodal coordination and
introduces a 3-stage progressive architecture. 1) Encoder-FiLM based
Aggregation Routing (EFA-Routing) injects instruction information into the
vision encoder to selectively aggregate and compress dual-stream visual tokens,
forming a instruction-aware latent representation. 2) Building upon this
compact visual encoding, LLM-FiLM based Pruning Routing (LFP-Routing)
introduces action intent into the language model by pruning
instruction-irrelevant visually grounded tokens, thereby achieving token-level
sparsity. 3) To ensure that compressed perception inputs can still support
accurate and coherent action generation, we introduce V-L-A Coupled Attention
(CAtten), which combines causal vision-language attention with bidirectional
action parallel decoding. Extensive experiments on the LIBERO benchmark and
real-world robotic tasks demonstrate that CogVLA achieves state-of-the-art
performance with success rates of 97.4% and 70.0%, respectively, while reducing
training costs by 2.5-fold and decreasing inference latency by 2.8-fold
compared to OpenVLA. CogVLA is open-sourced and publicly available at
https://github.com/JiuTian-VL/CogVLA.","Wei Li, Renshan Zhang, Rui Shao, Jie He, Liqiang Nie",2025-08-28 17:50:58+00:00,http://arxiv.org/abs/2508.21046v1,http://arxiv.org/pdf/2508.21046v1,"cs.CV, cs.RO"
HITTER: A HumanoId Table TEnnis Robot via Hierarchical Planning and Learning,"Humanoid robots have recently achieved impressive progress in locomotion and
whole-body control, yet they remain constrained in tasks that demand rapid
interaction with dynamic environments through manipulation. Table tennis
exemplifies such a challenge: with ball speeds exceeding 5 m/s, players must
perceive, predict, and act within sub-second reaction times, requiring both
agility and precision. To address this, we present a hierarchical framework for
humanoid table tennis that integrates a model-based planner for ball trajectory
prediction and racket target planning with a reinforcement learning-based
whole-body controller. The planner determines striking position, velocity and
timing, while the controller generates coordinated arm and leg motions that
mimic human strikes and maintain stability and agility across consecutive
rallies. Moreover, to encourage natural movements, human motion references are
incorporated during training. We validate our system on a general-purpose
humanoid robot, achieving up to 106 consecutive shots with a human opponent and
sustained exchanges against another humanoid. These results demonstrate
real-world humanoid table tennis with sub-second reactive control, marking a
step toward agile and interactive humanoid behaviors.","Zhi Su, Bike Zhang, Nima Rahmanian, Yuman Gao, Qiayuan Liao, Caitlin Regan, Koushil Sreenath, S. Shankar Sastry",2025-08-28 17:49:12+00:00,http://arxiv.org/abs/2508.21043v2,http://arxiv.org/pdf/2508.21043v2,cs.RO
