title,summary,authors,published,updated,url,pdf_url,matched_query,year
Probabilistic Latency Analysis of the Data Distribution Service in ROS 2,"Robot Operating System 2 (ROS 2) is now the de facto standard for robotic
communication, pairing UDP transport with the Data Distribution Service (DDS)
publish-subscribe middleware. DDS achieves reliability through periodic
heartbeats that solicit acknowledgments for missing samples and trigger
selective retransmissions. In lossy wireless networks, the tight coupling among
heartbeat period, IP fragmentation, and retransmission interval obscures end to
end latency behavior and leaves practitioners with little guidance on how to
tune these parameters. To address these challenges, we propose a probabilistic
latency analysis (PLA) that analytically models the reliable transmission
process of ROS 2 DDS communication using a discrete state approach. By
systematically analyzing both middleware level and transport level events, PLA
computes the steady state probability distribution of unacknowledged messages
and the retransmission latency. We validate our PLA across 270 scenarios,
exploring variations in packet delivery ratios, message sizes, and both
publishing and retransmission intervals, demonstrating a close alignment
between analytical predictions and experimental results. Our findings establish
a theoretical basis to systematically optimize reliability, latency, and
performance in wireless industrial robotics.","Sanghoon Lee, Hyung-Seok Park, Jiyeong Chae, Kyung-Joon Park",2025-08-14T07:36:51Z,2025-08-14T07:36:51Z,http://arxiv.org/abs/2508.10413v1,http://arxiv.org/pdf/2508.10413v1.pdf,all:ROS AND all:robot AND submittedDate:[202309062229 TO 202509052229],2025
"Observations of atypical users from a pilot deployment of a public-space
  social robot in a church","Though a goal of HRI is the natural integration of social robots into
everyday public spaces, real-world studies still occur mostly within controlled
environments with predetermined participants. True public spaces present an
environment which is largely unconstrained and unpredictable, frequented by a
diverse range of people whose goals can often conflict with those of the robot.
When combined with the general unfamiliarity most people have with social
robots, this leads to unexpected human-robot interactions in these public
spaces that are rarely discussed or detected in other contexts. In this paper,
we describe atypical users we observed interacting with our robot, and those
who did not, during a three-day pilot deployment within a large working church
and visitor attraction. We then discuss theoretical future advances in the
field that could address these challenges, as well as immediate practical
mitigations and strategies to help improve public space human-robot
interactions in the present. This work contributes empirical insights into the
dynamics of human-robot interaction in public environments and offers
actionable guidance for more effective future deployments for social robot
designers.","Andrew Blair, Peggy Gregory, Mary Ellen Foster",2025-08-14T07:35:11Z,2025-08-14T07:35:11Z,http://arxiv.org/abs/2508.16622v1,http://arxiv.org/pdf/2508.16622v1.pdf,all:ROS AND all:robot AND submittedDate:[202309062229 TO 202509052229],2025
"AZRA: Extending the Affective Capabilities of Zoomorphic Robots using
  Augmented Reality","Zoomorphic robots could serve as accessible and practical alternatives for
users unable or unwilling to keep pets. However, their affective interactions
are often simplistic and short-lived, limiting their potential for domestic
adoption. In order to facilitate more dynamic and nuanced affective
interactions and relationships between users and zoomorphic robots we present
AZRA, a novel augmented reality (AR) framework that extends the affective
capabilities of these robots without physical modifications. To demonstrate
AZRA, we augment a zoomorphic robot, Petit Qoobo, with novel emotional displays
(face, light, sound, thought bubbles) and interaction modalities (voice, touch,
proximity, gaze). Additionally, AZRA features a computational model of emotion
to calculate the robot's emotional responses, daily moods, evolving personality
and needs. We highlight how AZRA can be used for rapid participatory
prototyping and enhancing existing robots, then discuss implications on future
zoomorphic robot development.","Shaun Macdonald, Salma ElSayed, Mark McGill",2025-08-11T22:39:13Z,2025-08-11T22:39:13Z,http://arxiv.org/abs/2508.08507v1,http://arxiv.org/pdf/2508.08507v1.pdf,all:ROS AND all:robot AND submittedDate:[202309062229 TO 202509052229],2025
"MonoMPC: Monocular Vision Based Navigation with Learned Collision Model
  and Risk-Aware Model Predictive Control","Navigating unknown environments with a single RGB camera is challenging, as
the lack of depth information prevents reliable collision-checking. While some
methods use estimated depth to build collision maps, we found that depth
estimates from vision foundation models are too noisy for zero-shot navigation
in cluttered environments.
  We propose an alternative approach: instead of using noisy estimated depth
for direct collision-checking, we use it as a rich context input to a learned
collision model. This model predicts the distribution of minimum obstacle
clearance that the robot can expect for a given control sequence. At inference,
these predictions inform a risk-aware MPC planner that minimizes estimated
collision risk. Our joint learning pipeline co-trains the collision model and
risk metric using both safe and unsafe trajectories. Crucially, our
joint-training ensures optimal variance in our collision model that improves
navigation in highly cluttered environments. Consequently, real-world
experiments show 9x and 7x improvements in success rates over NoMaD and the ROS
stack, respectively. Ablation studies further validate the effectiveness of our
design choices.","Basant Sharma, Prajyot Jadhav, Pranjal Paul, K. Madhava Krishna, Arun Kumar Singh",2025-08-10T15:27:23Z,2025-08-10T15:27:23Z,http://arxiv.org/abs/2508.07387v1,http://arxiv.org/pdf/2508.07387v1.pdf,all:ROS AND all:robot AND submittedDate:[202309062229 TO 202509052229],2025
Manipulator for people with limited abilities,"The topic of this final qualification work was chosen due to the importance
of developing robotic systems designed to assist people with disabilities.
Advances in robotics and automation technologies have opened up new prospects
for creating devices that can significantly improve the quality of life for
these people. In this context, designing a robotic hand with a control system
adapted to the needs of people with disabilities is a major scientific and
practical challenge. This work addresses the problem of developing and
manufacturing a four-degree-of-freedom robotic hand suitable for practical
manipulation. Addressing this issue requires a comprehensive approach,
encompassing the design of the hand's mechanical structure, the development of
its control system, and its integration with a technical vision system and
software based on the Robot Operating System (ROS).","Bingkun Huang, Evgeniy Kotov, Arkady Yuschenko",2025-08-09T12:35:31Z,2025-08-09T12:35:31Z,http://arxiv.org/abs/2508.06969v1,http://arxiv.org/pdf/2508.06969v1.pdf,all:ROS AND all:robot AND submittedDate:[202309062229 TO 202509052229],2025
Robots can defuse high-intensity conflict situations,"This paper investigates the specific scenario of high-intensity
confrontations between humans and robots, to understand how robots can defuse
the conflict. It focuses on the effectiveness of using five different affective
expression modalities as main drivers for defusing the conflict. The aim is to
discover any strengths or weaknesses in using each modality to mitigate the
hostility that people feel towards a poorly performing robot. The defusing of
the situation is accomplished by making the robot better at acknowledging the
conflict and by letting it express remorse. To facilitate the tests, we used a
custom affective robot in a simulated conflict situation with 105 test
participants. The results show that all tested expression modalities can
successfully be used to defuse the situation and convey an acknowledgment of
the confrontation. The ratings were remarkably similar, but the movement
modality was different (ANON p$<$.05) than the other modalities. The test
participants also had similar affective interpretations on how impacted the
robot was of the confrontation across all expression modalities. This indicates
that defusing a high-intensity interaction may not demand special attention to
the expression abilities of the robot, but rather require attention to the
abilities of being socially aware of the situation and reacting in accordance
with it.","Morten Roed Frederiksen, Kasper Støy",2025-08-07T13:16:46Z,2025-08-07T13:16:46Z,http://arxiv.org/abs/2508.05373v1,http://arxiv.org/pdf/2508.05373v1.pdf,all:ROS AND all:robot AND submittedDate:[202309062229 TO 202509052229],2025
Affecta-Context: The Context-Guided Behavior Adaptation Framework,"This paper presents Affecta-context, a general framework to facilitate
behavior adaptation for social robots. The framework uses information about the
physical context to guide its behaviors in human-robot interactions. It
consists of two parts: one that represents encountered contexts and one that
learns to prioritize between behaviors through human-robot interactions. As
physical contexts are encountered the framework clusters them by their measured
physical properties. In each context, the framework learns to prioritize
between behaviors to optimize the physical attributes of the robot's behavior
in line with its current environment and the preferences of the users it
interacts with. This paper illlustrates the abilities of the Affecta-context
framework by enabling a robot to autonomously learn the prioritization of
discrete behaviors. This was achieved by training across 72 interactions in two
different physical contexts with 6 different human test participants. The paper
demonstrates the trained Affecta-context framework by verifying the robot's
ability to generalize over the input and to match its behaviors to a previously
unvisited physical context.","Morten Roed Frederiksen, Kasper Støy",2025-08-07T13:07:44Z,2025-08-07T13:07:44Z,http://arxiv.org/abs/2508.05359v1,http://arxiv.org/pdf/2508.05359v1.pdf,all:ROS AND all:robot AND submittedDate:[202309062229 TO 202509052229],2025
"Towards Embodied Agentic AI: Review and Classification of LLM- and
  VLM-Driven Robot Autonomy and Interaction","Foundation models, including large language models (LLMs) and vision-language
models (VLMs), have recently enabled novel approaches to robot autonomy and
human-robot interfaces. In parallel, vision-language-action models (VLAs) or
large behavior models (LBMs) are increasing the dexterity and capabilities of
robotic systems. This survey paper focuses on those works advancing towards
agentic applications and architectures. This includes initial efforts exploring
GPT-style interfaces to tooling, as well as more complex system where AI agents
are coordinators, planners, perception actors, or generalist interfaces. Such
agentic architectures allow robots to reason over natural language
instructions, invoke APIs, plan task sequences, or assist in operations and
diagnostics. In addition to peer-reviewed research, due to the fast-evolving
nature of the field, we highlight and include community-driven projects, ROS
packages, and industrial frameworks that show emerging trends. We propose a
taxonomy for classifying model integration approaches and present a comparative
analysis of the role that agents play in different solutions in today's
literature.","Sahar Salimpour, Lei Fu, Farhad Keramat, Leonardo Militano, Giovanni Toffetti, Harry Edelman, Jorge Peña Queralta",2025-08-07T11:48:03Z,2025-08-14T12:55:31Z,http://arxiv.org/abs/2508.05294v2,http://arxiv.org/pdf/2508.05294v2.pdf,all:ROS AND all:robot AND submittedDate:[202309062229 TO 202509052229],2025
"From Canada to Japan: How 10,000 km Affect User Perception in Robot
  Teleoperation","Robot teleoperation (RTo) has emerged as a viable alternative to local
control, particularly when human intervention is still necessary. This research
aims to study the distance effect on user perception in RTo, exploring the
potential of teleoperated robots for older adult care. We propose an evaluation
of non-expert users' perception of long-distance RTo, examining how their
perception changes before and after interaction, as well as comparing it to
that of locally operated robots. We have designed a specific protocol
consisting of multiple questionnaires, along with a dedicated software
architecture using the Robotics Operating System (ROS) and Unity. The results
revealed no statistically significant differences between the local and remote
robot conditions, suggesting that robots may be a viable alternative to
traditional local control.","Siméon Capy, Thomas M. Kwok, Kevin Joseph, Yuichiro Kawasumi, Koichi Nagashima, Tomoya Sasaki, Yue Hu, Eiichi Yoshida",2025-08-07T08:25:20Z,2025-08-07T08:25:20Z,http://arxiv.org/abs/2508.05143v1,http://arxiv.org/pdf/2508.05143v1.pdf,all:ROS AND all:robot AND submittedDate:[202309062229 TO 202509052229],2025
"On the causality between affective impact and coordinated human-robot
  reactions","In an effort to improve how robots function in social contexts, this paper
investigates if a robot that actively shares a reaction to an event with a
human alters how the human perceives the robot's affective impact. To verify
this, we created two different test setups. One to highlight and isolate the
reaction element of affective robot expressions, and one to investigate the
effects of applying specific timing delays to a robot reacting to a physical
encounter with a human. The first test was conducted with two different groups
(n=84) of human observers, a test group and a control group both interacting
with the robot. The second test was performed with 110 participants using
increasingly longer reaction delays for the robot with every ten participants.
The results show a statistically significant change (p$<$.05) in perceived
affective impact for the robots when they react to an event shared with a human
observer rather than reacting at random. The result also shows for shared
physical interaction, the near-human reaction times from the robot are most
appropriate for the scenario. The paper concludes that a delay time around
200ms may render the biggest impact on human observers for small-sized
non-humanoid robots. It further concludes that a slightly shorter reaction time
around 100ms is most effective when the goal is to make the human observers
feel they made the biggest impact on the robot.","Morten Roed Frederiksen, Kasper Støy",2025-08-06T19:24:04Z,2025-08-06T19:24:04Z,http://arxiv.org/abs/2508.04834v1,http://arxiv.org/pdf/2508.04834v1.pdf,all:ROS AND all:robot AND submittedDate:[202309062229 TO 202509052229],2025
Tactile Comfort: Lowering Heart Rate Through Interactions,"Children diagnosed with anxiety disorders are taught a range of strategies to
navigate situations of heightened anxiety. Techniques such as deep breathing
and repetition of mantras are commonly employed, as they are known to be
calming and reduce elevated heart rates. Although these strategies are often
effective, their successful application relies on prior training of the
children for successful use when faced with challenging situations. This paper
investigates a pocket-sized companion robot designed to offer a relaxation
technique requiring no prior training, with a focus on immediate impact on the
user's heart rate. The robot utilizes a tactile game to divert the user's
attention, thereby promoting relaxation. We conducted two studies with children
who were not diagnosed with anxiety: a 14-day pilot study with two children
(age 8) and a main study with 18 children (ages 7-8). Both studies employed a
within-subjects design and focused on measuring heart rate during tactile
interaction with the robot and during non-use. Interacting with the robot was
found to significantly lower the study participants' heart rate (p$<$0.01)
compared to the non-use condition, indicating a consistent calming effect
across all participants. These results suggest that tactile companion robots
have the potential to enhance the therapeutic value of relaxation techniques.","Morten Roed Frederiksen, Kasper Støy, Maja Matarić",2025-08-06T12:06:35Z,2025-08-06T12:06:35Z,http://arxiv.org/abs/2508.04372v1,http://arxiv.org/pdf/2508.04372v1.pdf,all:ROS AND all:robot AND submittedDate:[202309062229 TO 202509052229],2025
"Stinger Robot: A Self-Bracing Robotic Platform for Autonomous Drilling
  in Confined Underground Environments","The increasing demand for critical raw materials has revitalized interest in
abandoned underground mines, which pose extreme challenges for conventional
drilling machinery due to confined, unstructured, and infrastructure-less
environments. This paper presents the Stinger Robot, a novel compact robotic
platform specifically designed for autonomous high-force drilling in such
settings. The robot features a mechanically self-locking tri-leg bracing
mechanism that enables stable anchoring to irregular tunnel surfaces. A key
innovation lies in its force-aware, closed-loop control strategy, which enables
force interaction with unstructured environments during bracing and drilling.
Implemented as a finite-state machine in ROS 2, the control policy dynamically
adapts leg deployment based on real-time contact feedback and load thresholds,
ensuring stability without external supports. We demonstrate, through
simulation and preliminary hardware tests, that the Stinger Robot can
autonomously stabilize and drill in conditions previously inaccessible to
nowadays mining machines. This work constitutes the first validated robotic
architecture to integrate distributed force-bracing and autonomous drilling in
underground environments, laying the groundwork for future collaborative mining
operations using modular robot systems.","H. Liu, L. S. Moreu, T. S. Andersen, V. V. Puche, M. Fumagalli",2025-07-31T20:05:14Z,2025-07-31T20:05:14Z,http://arxiv.org/abs/2508.06521v1,http://arxiv.org/pdf/2508.06521v1.pdf,all:ROS AND all:robot AND submittedDate:[202309062229 TO 202509052229],2025
Distributed AI Agents for Cognitive Underwater Robot Autonomy,"Achieving robust cognitive autonomy in robots navigating complex,
unpredictable environments remains a fundamental challenge in robotics. This
paper presents Underwater Robot Self-Organizing Autonomy (UROSA), a
groundbreaking architecture leveraging distributed Large Language Model AI
agents integrated within the Robot Operating System 2 (ROS 2) framework to
enable advanced cognitive capabilities in Autonomous Underwater Vehicles. UROSA
decentralises cognition into specialised AI agents responsible for multimodal
perception, adaptive reasoning, dynamic mission planning, and real-time
decision-making. Central innovations include flexible agents dynamically
adapting their roles, retrieval-augmented generation utilising vector databases
for efficient knowledge management, reinforcement learning-driven behavioural
optimisation, and autonomous on-the-fly ROS 2 node generation for runtime
functional extensibility. Extensive empirical validation demonstrates UROSA's
promising adaptability and reliability through realistic underwater missions in
simulation and real-world deployments, showing significant advantages over
traditional rule-based architectures in handling unforeseen scenarios,
environmental uncertainties, and novel mission objectives. This work not only
advances underwater autonomy but also establishes a scalable, safe, and
versatile cognitive robotics framework capable of generalising to a diverse
array of real-world applications.","Markus Buchholz, Ignacio Carlucho, Michele Grimaldi, Yvan R. Petillot",2025-07-31T17:18:55Z,2025-08-04T08:56:21Z,http://arxiv.org/abs/2507.23735v2,http://arxiv.org/pdf/2507.23735v2.pdf,all:ROS AND all:robot AND submittedDate:[202309062229 TO 202509052229],2025
"RobEthiChor: Automated Context-aware Ethics-based Negotiation for
  Autonomous Robots","The presence of autonomous systems is growing at a fast pace and it is
impacting many aspects of our lives. Designed to learn and act independently,
these systems operate and perform decision-making without human intervention.
However, they lack the ability to incorporate users' ethical preferences, which
are unique for each individual in society and are required to personalize the
decision-making processes. This reduces user trust and prevents autonomous
systems from behaving according to the moral beliefs of their end-users. When
multiple systems interact with differing ethical preferences, they must
negotiate to reach an agreement that satisfies the ethical beliefs of all the
parties involved and adjust their behavior consequently. To address this
challenge, this paper proposes RobEthiChor, an approach that enables autonomous
systems to incorporate user ethical preferences and contextual factors into
their decision-making through ethics-based negotiation. RobEthiChor features a
domain-agnostic reference architecture for designing autonomous systems capable
of ethic-based negotiating. The paper also presents RobEthiChor-Ros, an
implementation of RobEthiChor within the Robot Operating System (ROS), which
can be deployed on robots to provide them with ethics-based negotiation
capabilities. To evaluate our approach, we deployed RobEthiChor-Ros on real
robots and ran scenarios where a pair of robots negotiate upon resource
contention. Experimental results demonstrate the feasibility and effectiveness
of the system in realizing ethics-based negotiation. RobEthiChor allowed robots
to reach an agreement in more than 73\% of the scenarios with an acceptable
negotiation time (0.67s on average). Experiments also demonstrate that the
negotiation approach implemented in RobEthiChor is scalable.","Mashal Afzal Memon, Gianluca Filippone, Gian Luca Scoccia, Marco Autili, Paola Inverardi",2025-07-30T13:21:38Z,2025-07-30T13:21:38Z,http://arxiv.org/abs/2507.22664v1,http://arxiv.org/pdf/2507.22664v1.pdf,all:ROS AND all:robot AND submittedDate:[202309062229 TO 202509052229],2025
"DISCOVERSE: Efficient Robot Simulation in Complex High-Fidelity
  Environments","We present the first unified, modular, open-source 3DGS-based simulation
framework for Real2Sim2Real robot learning. It features a holistic Real2Sim
pipeline that synthesizes hyper-realistic geometry and appearance of complex
real-world scenarios, paving the way for analyzing and bridging the Sim2Real
gap. Powered by Gaussian Splatting and MuJoCo, Discoverse enables massively
parallel simulation of multiple sensor modalities and accurate physics, with
inclusive supports for existing 3D assets, robot models, and ROS plugins,
empowering large-scale robot learning and complex robotic benchmarks. Through
extensive experiments on imitation learning, Discoverse demonstrates
state-of-the-art zero-shot Sim2Real transfer performance compared to existing
simulators. For code and demos: https://air-discoverse.github.io/.","Yufei Jia, Guangyu Wang, Yuhang Dong, Junzhe Wu, Yupei Zeng, Haonan Lin, Zifan Wang, Haizhou Ge, Weibin Gu, Kairui Ding, Zike Yan, Yunjie Cheng, Yue Li, Ziming Wang, Chuxuan Li, Wei Sui, Lu Shi, Guanzhong Tian, Ruqi Huang, Guyue Zhou",2025-07-29T16:33:32Z,2025-07-29T16:33:32Z,http://arxiv.org/abs/2507.21981v1,http://arxiv.org/pdf/2507.21981v1.pdf,all:ROS AND all:robot AND submittedDate:[202309062229 TO 202509052229],2025
"NMPCM: Nonlinear Model Predictive Control on Resource-Constrained
  Microcontrollers","Nonlinear Model Predictive Control (NMPC) is a powerful approach for
controlling highly dynamic robotic systems, as it accounts for system dynamics
and optimizes control inputs at each step. However, its high computational
complexity makes implementation on resource-constrained microcontrollers
impractical. While recent studies have demonstrated the feasibility of Model
Predictive Control (MPC) with linearized dynamics on microcontrollers, applying
full NMPC remains a significant challenge. This work presents an efficient
solution for generating and deploying NMPC on microcontrollers (NMPCM) to
control quadrotor UAVs. The proposed method optimizes computational efficiency
while maintaining high control accuracy. Simulations in Gazebo/ROS and
real-world experiments validate the effectiveness of the approach,
demonstrating its capability to achieve high-frequency NMPC execution in
real-time systems. The code is available at:
https://github.com/aralab-unr/NMPCM.","Van Chung Nguyen, Pratik Walunj, Chuong Le, An Duy Nguyen, Hung Manh La",2025-07-28T18:25:05Z,2025-07-28T18:25:05Z,http://arxiv.org/abs/2507.21259v1,http://arxiv.org/pdf/2507.21259v1.pdf,all:ROS AND all:robot AND submittedDate:[202309062229 TO 202509052229],2025
