title,summary,authors,published,updated,url,pdf_url,matched_query,year
"HIPPO-MAT: Decentralized Task Allocation Using GraphSAGE and Multi-Agent
  Deep Reinforcement Learning","This paper tackles decentralized continuous task allocation in heterogeneous
multi-agent systems. We present a novel framework HIPPO-MAT that integrates
graph neural networks (GNN) employing a GraphSAGE architecture to compute
independent embeddings on each agent with an Independent Proximal Policy
Optimization (IPPO) approach for multi-agent deep reinforcement learning. In
our system, unmanned aerial vehicles (UAVs) and unmanned ground vehicles (UGVs)
share aggregated observation data via communication channels while
independently processing these inputs to generate enriched state embeddings.
This design enables dynamic, cost-optimal, conflict-aware task allocation in a
3D grid environment without the need for centralized coordination. A modified
A* path planner is incorporated for efficient routing and collision avoidance.
Simulation experiments demonstrate scalability with up to 30 agents and
preliminary real-world validation on JetBot ROS AI Robots, each running its
model on a Jetson Nano and communicating through an ESP-NOW protocol using
ESP32-S3, which confirms the practical viability of the approach that
incorporates simultaneous localization and mapping (SLAM). Experimental results
revealed that our method achieves a high 92.5% conflict-free success rate, with
only a 16.49% performance gap compared to the centralized Hungarian method,
while outperforming the heuristic decentralized baseline based on greedy
approach. Additionally, the framework exhibits scalability with up to 30 agents
with allocation processing of 0.32 simulation step time and robustness in
responding to dynamically generated tasks.","Lavanya Ratnabala, Robinroy Peter, Aleksey Fedoseev, Dzmitry Tsetserukou",2025-03-08T10:44:14Z,2025-03-08T10:44:14Z,http://arxiv.org/abs/2503.07662v1,http://arxiv.org/pdf/2503.07662v1.pdf,all:ROS AND all:robot AND submittedDate:[202309062229 TO 202509052229],2025
"HyperGraph ROS: An Open-Source Robot Operating System for Hybrid
  Parallel Computing based on Computational HyperGraph","This paper presents HyperGraph ROS, an open-source robot operating system
that unifies intra-process, inter-process, and cross-device computation into a
computational hypergraph for efficient message passing and parallel execution.
In order to optimize communication, HyperGraph ROS dynamically selects the
optimal communication mechanism while maintaining a consistent API. For
intra-process messages, Intel-TBB Flow Graph is used with C++ pointer passing,
which ensures zero memory copying and instant delivery. Meanwhile,
inter-process and cross-device communication seamlessly switch to ZeroMQ. When
a node receives a message from any source, it is immediately activated and
scheduled for parallel execution by Intel-TBB. The computational hypergraph
consists of nodes represented by TBB flow graph nodes and edges formed by TBB
pointer-based connections for intra-process communication, as well as ZeroMQ
links for inter-process and cross-device communication. This structure enables
seamless distributed parallelism. Additionally, HyperGraph ROS provides
ROS-like utilities such as a parameter server, a coordinate transformation
tree, and visualization tools. Evaluation in diverse robotic scenarios
demonstrates significantly higher transmission and throughput efficiency
compared to ROS 2. Our work is available at
https://github.com/wujiazheng2020a/hyper_graph_ros.","Shufang Zhang, Jiazheng Wu, Jiacheng He, Kaiyi Wang, Shan An",2025-03-07T03:29:52Z,2025-03-07T03:29:52Z,http://arxiv.org/abs/2503.05117v1,http://arxiv.org/pdf/2503.05117v1.pdf,all:ROS AND all:robot AND submittedDate:[202309062229 TO 202509052229],2025
PERCY: Personal Emotional Robotic Conversational System,"Traditional rule-based conversational robots, constrained by predefined
scripts and static response mappings, fundamentally lack adaptability for
personalized, long-term human interaction. While Large Language Models (LLMs)
like GPT-4 have revolutionized conversational AI through open-domain
capabilities, current social robots implementing LLMs still lack emotional
awareness and continuous personalization. This dual limitation hinders their
ability to sustain engagement across multiple interaction sessions. We bridge
this gap with PERCY (Personal Emotional Robotic Conversational sYstem), a
system designed to enable open-domain, multi-turn dialogues by dynamically
analyzing users' real-time facial expressions and vocabulary to tailor
responses based on their emotional state. Built on a ROS-based multimodal
framework, PERCY integrates a fine-tuned GPT-4 reasoning engine, combining
textual sentiment analysis with visual emotional cues to accurately assess and
respond to user emotions. We evaluated PERCY's performance through various
dialogue quality metrics, showing strong coherence, relevance, and diversity.
Human evaluations revealed PERCY's superior personalization and comparable
naturalness to other models. This work highlights the potential for integrating
advanced multimodal perception and personalization in social robot dialogue
systems.","Zhijin Meng, Mohammed Althubyani, Shengyuan Xie, Imran Razzak, Eduardo B. Sandoval, Mahdi Bamdad, Francisco Cruz",2025-03-04T03:11:47Z,2025-03-04T03:11:47Z,http://arxiv.org/abs/2503.16473v1,http://arxiv.org/pdf/2503.16473v1.pdf,all:ROS AND all:robot AND submittedDate:[202309062229 TO 202509052229],2025
A Navigation System for ROV's inspection on Fish Net Cage,"Autonomous Remotely Operated Vehicles (ROVs) offer a promising solution for
automating fishnet inspection, reducing labor dependency, and improving
operational efficiency. In this paper, we modify an off-the-shelf ROV, the
BlueROV2, into a ROS-based framework and develop a localization module, a path
planning system, and a control framework. For real-time, local localization, we
employ the open-source TagSLAM library. Additionally, we propose a control
strategy based on a Nominal Feedback Controller (NFC) to achieve precise
trajectory tracking. The proposed system has been implemented and validated
through experiments in a controlled laboratory environment, demonstrating its
effectiveness for real-world applications.","Zhikang Ge, Fang Yang, Wenwu Lu, Peng Wei, Yibin Ying, Chen Peng",2025-03-01T13:17:16Z,2025-03-01T13:17:16Z,http://arxiv.org/abs/2503.00482v1,http://arxiv.org/pdf/2503.00482v1.pdf,all:ROS AND all:robot AND submittedDate:[202309062229 TO 202509052229],2025
Ro-To-Go! Robust Reactive Control with Signal Temporal Logic,"Signal Temporal Logic (STL) robustness is a common objective for optimal
robot control, but its dependence on history limits the robot's decision-making
capabilities when used in Model Predictive Control (MPC) approaches. In this
work, we introduce Signal Temporal Logic robustness-to-go (Ro-To-Go), a new
quantitative semantics for the logic that isolates the contributions of suffix
trajectories. We prove its relationship to formula progression for Metric
Temporal Logic, and show that the robustness-to-go depends only on the suffix
trajectory and progressed formula. We implement robustness-to-go as the
objective in an MPC algorithm and use formula progression to efficiently
evaluate it online. We test the algorithm in simulation and compare it to MPC
using traditional STL robustness. Our experiments show that using
robustness-to-go results in a higher success rate.","Roland Ilyes, Lara Brudermüller, Nick Hawes, Bruno Lacerda",2025-02-28T18:00:23Z,2025-03-17T14:25:17Z,http://arxiv.org/abs/2503.05792v2,http://arxiv.org/pdf/2503.05792v2.pdf,all:ROS AND all:robot AND submittedDate:[202309062229 TO 202509052229],2025
The NavINST Dataset for Multi-Sensor Autonomous Navigation,"The NavINST Laboratory has developed a comprehensive multisensory dataset
from various road-test trajectories in urban environments, featuring diverse
lighting conditions, including indoor garage scenarios with dense 3D maps. This
dataset includes multiple commercial-grade IMUs and a high-end tactical-grade
IMU. Additionally, it contains a wide array of perception-based sensors, such
as a solid-state LiDAR - making it one of the first datasets to do so - a
mechanical LiDAR, four electronically scanning RADARs, a monocular camera, and
two stereo cameras. The dataset also includes forward speed measurements
derived from the vehicle's odometer, along with accurately post-processed
high-end GNSS/IMU data, providing precise ground truth positioning and
navigation information. The NavINST dataset is designed to support advanced
research in high-precision positioning, navigation, mapping, computer vision,
and multisensory fusion. It offers rich, multi-sensor data ideal for developing
and validating robust algorithms for autonomous vehicles. Finally, it is fully
integrated with the ROS, ensuring ease of use and accessibility for the
research community. The complete dataset and development tools are available at
https://navinst.github.io.","Paulo Ricardo Marques de Araujo, Eslam Mounier, Qamar Bader, Emma Dawson, Shaza I. Kaoud Abdelaziz, Ahmed Zekry, Mohamed Elhabiby, Aboelmagd Noureldin",2025-02-19T16:31:56Z,2025-02-19T16:31:56Z,http://arxiv.org/abs/2502.13863v1,http://arxiv.org/pdf/2502.13863v1.pdf,all:ROS AND all:robot AND submittedDate:[202309062229 TO 202509052229],2025
"SHIFT: An Interdisciplinary Framework for Scaffolding Human Attention
  and Understanding in Explanatory Tasks","In this work, we present a domain-independent approach for adaptive
scaffolding in robotic explanation generation to guide tasks in human-robot
interaction. We present a method for incorporating interdisciplinary research
results into a computational model as a pre-configured scoring system
implemented in a framework called SHIFT. This involves outlining a procedure
for integrating concepts from disciplines outside traditional computer science
into a robotics computational framework. Our approach allows us to model the
human cognitive state into six observable states within the human partner
model. To study the pre-configuration of the system, we implement a
reinforcement learning approach on top of our model. This approach allows
adaptation to individuals who deviate from the configuration of the scoring
system. Therefore, in our proof-of-concept evaluation, the model's adaptability
on four different user types shows that the models' adaptation performs better,
i.e., recouped faster after exploration and has a higher accumulated reward
with our pre-configured scoring system than without it. We discuss further
strategies of speeding up the learning phase to enable a realistic adaptation
behavior to real users. The system is accessible through docker and supports
querying via ROS.","André Groß, Birte Richter, Britta Wrede",2025-02-17T12:46:31Z,2025-02-17T12:46:31Z,http://arxiv.org/abs/2503.16447v1,http://arxiv.org/pdf/2503.16447v1.pdf,all:ROS AND all:robot AND submittedDate:[202309062229 TO 202509052229],2025
"A Multi-Simulation Approach with Model Predictive Control for Anafi
  Drones","Simulation frameworks are essential for the safe development of robotic
applications. However, different components of a robotic system are often best
simulated in different environments, making full integration challenging. This
is particularly true for partially-open or closed-source simulators, which
commonly suffer from two limitations: (i) lack of runtime control over scene
actors via interfaces like ROS, and (ii) restricted access to real-time state
data (e.g., pose, velocity) of scene objects. In the first part of this work,
we address these issues by integrating aerial drones simulated in Parrot's
Sphinx environment (used for Anafi drones) into the Gazebo simulator. Our
approach uses a mirrored drone instance embedded within Gazebo environments to
bridge the two simulators. One key application is aerial target tracking, a
common task in multi-robot systems. However, Parrot's default PID-based
controller lacks the agility needed for tracking fast-moving targets. To
overcome this, in the second part of this work we develop a model predictive
controller (MPC) that leverages cumulative error states to improve tracking
accuracy. Our MPC significantly outperforms the built-in PID controller in
dynamic scenarios, increasing the effectiveness of the overall system. We
validate our integrated framework by incorporating the Anafi drone into an
existing Gazebo-based airship simulation and rigorously test the MPC against a
custom PID baseline in both simulated and real-world experiments.","Pascal Goldschmid, Aamir Ahmad",2025-02-14T15:11:21Z,2025-07-12T19:46:58Z,http://arxiv.org/abs/2502.10218v2,http://arxiv.org/pdf/2502.10218v2.pdf,all:ROS AND all:robot AND submittedDate:[202309062229 TO 202509052229],2025
"Energy-Efficient Autonomous Aerial Navigation with Dynamic Vision
  Sensors: A Physics-Guided Neuromorphic Approach","Vision-based object tracking is a critical component for achieving autonomous
aerial navigation, particularly for obstacle avoidance. Neuromorphic Dynamic
Vision Sensors (DVS) or event cameras, inspired by biological vision, offer a
promising alternative to conventional frame-based cameras. These cameras can
detect changes in intensity asynchronously, even in challenging lighting
conditions, with a high dynamic range and resistance to motion blur. Spiking
neural networks (SNNs) are increasingly used to process these event-based
signals efficiently and asynchronously. Meanwhile, physics-based artificial
intelligence (AI) provides a means to incorporate system-level knowledge into
neural networks via physical modeling. This enhances robustness, energy
efficiency, and provides symbolic explainability. In this work, we present a
neuromorphic navigation framework for autonomous drone navigation. The focus is
on detecting and navigating through moving gates while avoiding collisions. We
use event cameras for detecting moving objects through a shallow SNN
architecture in an unsupervised manner. This is combined with a lightweight
energy-aware physics-guided neural network (PgNN) trained with depth inputs to
predict optimal flight times, generating near-minimum energy paths. The system
is implemented in the Gazebo simulator and integrates a sensor-fused
vision-to-planning neuro-symbolic framework built with the Robot Operating
System (ROS) middleware. This work highlights the future potential of
integrating event-based vision with physics-guided planning for
energy-efficient autonomous navigation, particularly for low-latency
decision-making.","Sourav Sanyal, Amogh Joshi, Manish Nagaraj, Rohan Kumar Manna, Kaushik Roy",2025-02-09T15:40:18Z,2025-04-23T17:55:38Z,http://arxiv.org/abs/2502.05938v2,http://arxiv.org/pdf/2502.05938v2.pdf,all:ROS AND all:robot AND submittedDate:[202309062229 TO 202509052229],2025
"Generating Physically Realistic and Directable Human Motions from
  Multi-Modal Inputs","This work focuses on generating realistic, physically-based human behaviors
from multi-modal inputs, which may only partially specify the desired motion.
For example, the input may come from a VR controller providing arm motion and
body velocity, partial key-point animation, computer vision applied to videos,
or even higher-level motion goals. This requires a versatile low-level humanoid
controller that can handle such sparse, under-specified guidance, seamlessly
switch between skills, and recover from failures. Current approaches for
learning humanoid controllers from demonstration data capture some of these
characteristics, but none achieve them all. To this end, we introduce the
Masked Humanoid Controller (MHC), a novel approach that applies multi-objective
imitation learning on augmented and selectively masked motion demonstrations.
The training methodology results in an MHC that exhibits the key capabilities
of catch-up to out-of-sync input commands, combining elements from multiple
motion sequences, and completing unspecified parts of motions from sparse
multimodal input. We demonstrate these key capabilities for an MHC learned over
a dataset of 87 diverse skills and showcase different multi-modal use cases,
including integration with planning frameworks to highlight MHC's ability to
solve new user-defined tasks without any finetuning.","Aayam Shrestha, Pan Liu, German Ros, Kai Yuan, Alan Fern",2025-02-08T17:02:11Z,2025-02-08T17:02:11Z,http://arxiv.org/abs/2502.05641v1,http://arxiv.org/pdf/2502.05641v1.pdf,all:ROS AND all:robot AND submittedDate:[202309062229 TO 202509052229],2025
"Demonstrating CavePI: Autonomous Exploration of Underwater Caves by
  Semantic Guidance","Enabling autonomous robots to safely and efficiently navigate, explore, and
map underwater caves is of significant importance to water resource management,
hydrogeology, archaeology, and marine robotics. In this work, we demonstrate
the system design and algorithmic integration of a visual servoing framework
for semantically guided autonomous underwater cave exploration. We present the
hardware and edge-AI design considerations to deploy this framework on a novel
AUV (Autonomous Underwater Vehicle) named CavePI. The guided navigation is
driven by a computationally light yet robust deep visual perception module,
delivering a rich semantic understanding of the environment. Subsequently, a
robust control mechanism enables CavePI to track the semantic guides and
navigate within complex cave structures. We evaluate the system through field
experiments in natural underwater caves and spring-water sites and further
validate its ROS (Robot Operating System)-based digital twin in a simulation
environment. Our results highlight how these integrated design choices
facilitate reliable navigation under feature-deprived, GPS-denied, and
low-visibility conditions.","Alankrit Gupta, Adnan Abdullah, Xianyao Li, Vaishnav Ramesh, Ioannis Rekleitis, Md Jahidul Islam",2025-02-07T23:43:34Z,2025-04-24T17:16:47Z,http://arxiv.org/abs/2502.05384v4,http://arxiv.org/pdf/2502.05384v4.pdf,all:ROS AND all:robot AND submittedDate:[202309062229 TO 202509052229],2025
"Reduce Lap Time for Autonomous Racing with Curvature-Integrated MPCC
  Local Trajectory Planning Method","The widespread application of autonomous driving technology has significantly
advanced the field of autonomous racing. Model Predictive Contouring Control
(MPCC) is a highly effective local trajectory planning method for autonomous
racing. However, the traditional MPCC method struggles with racetracks that
have significant curvature changes, limiting the performance of the vehicle
during autonomous racing. To address this issue, we propose a
curvature-integrated MPCC (CiMPCC) local trajectory planning method for
autonomous racing. This method optimizes the velocity of the local trajectory
based on the curvature of the racetrack centerline. The specific implementation
involves mapping the curvature of the racetrack centerline to a reference
velocity profile, which is then incorporated into the cost function for
optimizing the velocity of the local trajectory. This reference velocity
profile is created by normalizing and mapping the curvature of the racetrack
centerline, thereby ensuring efficient and performance-oriented local
trajectory planning in racetracks with significant curvature. The proposed
CiMPCC method has been experimented on a self-built 1:10 scale F1TENTH racing
vehicle deployed with ROS platform. The experimental results demonstrate that
the proposed method achieves outstanding results on a challenging racetrack
with sharp curvature, improving the overall lap time by 11.4%-12.5% compared to
other autonomous racing trajectory planning methods. Our code is available at
https://github.com/zhouhengli/CiMPCC.","Zhouheng Li, Lei Xie, Cheng Hu, Hongye Su",2025-02-06T01:03:54Z,2025-02-06T01:03:54Z,http://arxiv.org/abs/2502.03695v1,http://arxiv.org/pdf/2502.03695v1.pdf,all:ROS AND all:robot AND submittedDate:[202309062229 TO 202509052229],2025
"Force-Based Robotic Imitation Learning: A Two-Phase Approach for
  Construction Assembly Tasks","The drive for efficiency and safety in construction has boosted the role of
robotics and automation. However, complex tasks like welding and pipe insertion
pose challenges due to their need for precise adaptive force control, which
complicates robotic training. This paper proposes a two-phase system to improve
robot learning, integrating human-derived force feedback. The first phase
captures real-time data from operators using a robot arm linked with a virtual
simulator via ROS-Sharp. In the second phase, this feedback is converted into
robotic motion instructions, using a generative approach to incorporate force
feedback into the learning process. This method's effectiveness is demonstrated
through improved task completion times and success rates. The framework
simulates realistic force-based interactions, enhancing the training data's
quality for precise robotic manipulation in construction tasks.","Hengxu You, Yang Ye, Tianyu Zhou, Jing Du",2025-01-24T22:01:23Z,2025-01-24T22:01:23Z,http://arxiv.org/abs/2501.14942v1,http://arxiv.org/pdf/2501.14942v1.pdf,all:ROS AND all:robot AND submittedDate:[202309062229 TO 202509052229],2025
"HAMMER: Heterogeneous, Multi-Robot Semantic Gaussian Splatting","3D Gaussian Splatting offers expressive scene reconstruction, modeling a
broad range of visual, geometric, and semantic information. However, efficient
real-time map reconstruction with data streamed from multiple robots and
devices remains a challenge. To that end, we propose HAMMER, a server-based
collaborative Gaussian Splatting method that leverages widely available ROS
communication infrastructure to generate 3D, metric-semantic maps from
asynchronous robot data-streams with no prior knowledge of initial robot
positions and varying on-device pose estimators. HAMMER consists of (i) a frame
alignment module that transforms local SLAM poses and image data into a global
frame and requires no prior relative pose knowledge, and (ii) an online module
for training semantic 3DGS maps from streaming data. HAMMER handles mixed
perception modes, adjusts automatically for variations in image pre-processing
among different devices, and distills CLIP semantic codes into the 3D scene for
open-vocabulary language queries. In our real-world experiments, HAMMER creates
higher-fidelity maps (2x) compared to competing baselines and is useful for
downstream tasks, such as semantic goal-conditioned navigation (e.g., ""go to
the couch""). Accompanying content available at hammer-project.github.io.","Javier Yu, Timothy Chen, Mac Schwager",2025-01-24T00:21:10Z,2025-06-03T16:34:57Z,http://arxiv.org/abs/2501.14147v2,http://arxiv.org/pdf/2501.14147v2.pdf,all:ROS AND all:robot AND submittedDate:[202309062229 TO 202509052229],2025
"RTAMT -- Runtime Robustness Monitors with Application to CPS and
  Robotics","In this paper, we present Real-Time Analog Monitoring Tool (RTAMT), a tool
for quantitative monitoring of Signal Temporal Logic (STL) specifications. The
library implements a flexible architecture that supports: (1) various
environments connected by an Application Programming Interface (API) in Python,
(2) various flavors of temporal logic specification and robustness notion such
as STL, including an interface-aware variant that distinguishes between input
and output variables, and (3) discrete-time and dense-time interpretation of
STL with generation of online and offline monitors. We specifically focus on
robotics and Cyber-Physical Systems (CPSs) applications, showing how to
integrate RTAMT with (1) the Robot Operating System (ROS) and (2)
MATLAB/Simulink environments. We evaluate the tool by demonstrating several use
scenarios involving service robotic and avionic applications.","Tomoya Yamaguchi, Bardh Hoxha, Dejan Nickovic",2025-01-22T10:38:36Z,2025-01-22T10:38:36Z,http://arxiv.org/abs/2501.18608v1,http://arxiv.org/pdf/2501.18608v1.pdf,all:ROS AND all:robot AND submittedDate:[202309062229 TO 202509052229],2025
"Multi-LiCa: A Motion and Targetless Multi LiDAR-to-LiDAR Calibration
  Framework","Today's autonomous vehicles rely on a multitude of sensors to perceive their
environment. To improve the perception or create redundancy, the sensor's
alignment relative to each other must be known. With Multi-LiCa, we present a
novel approach for the alignment, e.g. calibration. We present an automatic
motion- and targetless approach for the extrinsic multi LiDAR-to-LiDAR
calibration without the need for additional sensor modalities or an initial
transformation input. We propose a two-step process with feature-based matching
for the coarse alignment and a GICP-based fine registration in combination with
a cost-based matching strategy. Our approach can be applied to any number of
sensors and positions if there is a partial overlap between the field of view
of single sensors. We show that our pipeline is better generalized to different
sensor setups and scenarios and is on par or better in calibration accuracy
than existing approaches. The presented framework is integrated in ROS 2 but
can also be used as a standalone application. To build upon our work, our
source code is available at: https://github.com/TUMFTM/Multi_LiCa.","Dominik Kulmer, Ilir Tahiraj, Andrii Chumak, Markus Lienkamp",2025-01-19T15:56:04Z,2025-01-19T15:56:04Z,http://arxiv.org/abs/2501.11088v1,http://arxiv.org/pdf/2501.11088v1.pdf,all:ROS AND all:robot AND submittedDate:[202309062229 TO 202509052229],2025
