title,summary,authors,published,updated,url,pdf_url,matched_query,year
"Voxel Map to Occupancy Map Conversion Using Free Space Projection for
  Efficient Map Representation for Aerial and Ground Robots","This article introduces a novel method for converting 3D voxel maps, commonly
utilized by robots for localization and navigation, into 2D occupancy maps for
both unmanned aerial vehicles (UAVs) and unmanned ground vehicles (UGVs). The
generated 2D maps can be used for more efficient global navigation for both
UAVs and UGVs, in enabling algorithms developed for 2D maps to be useful in 3D
applications, and allowing for faster transfer of maps between multiple agents
in bandwidth-limited scenarios. The proposed method uses the free space
representation in the UFOMap mapping solution to generate 2D occupancy maps.
During the 3D to 2D map conversion, the method conducts safety checks and
eliminates free spaces in the map with dimensions (in the height axis) lower
than the robot's safety margins. This ensures that an aerial or ground robot
can navigate safely, relying primarily on the 2D map generated by the method.
Additionally, the method extracts the height of navigable free space and a
local estimate of the slope of the floor from the 3D voxel map. The height data
is utilized in converting paths generated using the 2D map into paths in 3D
space for both UAVs and UGVs. The slope data identifies areas too steep for a
ground robot to traverse, marking them as occupied, thus enabling a more
accurate representation of the terrain for ground robots. The effectiveness of
the proposed method in enabling computationally efficient navigation for both
aerial and ground robots is validated in two different environments, over both
static maps and in online implementation in an exploration mission. The methods
proposed within this article have been implemented in the popular robotics
framework ROS and are open-sourced. The code is available at:
https://github.com/LTU-RAI/Map-Conversion-3D-Voxel-Map-to-2D-Occupancy-Map.","Scott Fredriksson, Akshit Saradagi, George Nikolakopoulos",2024-06-11T13:55:37Z,2024-07-21T10:38:22Z,http://arxiv.org/abs/2406.07270v2,http://arxiv.org/pdf/2406.07270v2.pdf,all:ROS AND all:robot AND submittedDate:[202309062229 TO 202509052229],2024
I2EDL: Interactive Instruction Error Detection and Localization,"In the Vision-and-Language Navigation in Continuous Environments (VLN-CE)
task, the human user guides an autonomous agent to reach a target goal via a
series of low-level actions following a textual instruction in natural
language. However, most existing methods do not address the likely case where
users may make mistakes when providing such instruction (e.g. ""turn left""
instead of ""turn right""). In this work, we address a novel task of Interactive
VLN in Continuous Environments (IVLN-CE), which allows the agent to interact
with the user during the VLN-CE navigation to verify any doubts regarding the
instruction errors. We propose an Interactive Instruction Error Detector and
Localizer (I2EDL) that triggers the user-agent interaction upon the detection
of instruction errors during the navigation. We leverage a pre-trained module
to detect instruction errors and pinpoint them in the instruction by
cross-referencing the textual input and past observations. In such way, the
agent is able to query the user for a timely correction, without demanding the
user's cognitive load, as we locate the probable errors to a precise part of
the instruction. We evaluate the proposed I2EDL on a dataset of instructions
containing errors, and further devise a novel metric, the Success weighted by
Interaction Number (SIN), to reflect both the navigation performance and the
interaction effectiveness. We show how the proposed method can ask focused
requests for corrections to the user, which in turn increases the navigation
success, while minimizing the interactions.","Francesco Taioli, Stefano Rosa, Alberto Castellini, Lorenzo Natale, Alessio Del Bue, Alessandro Farinelli, Marco Cristani, Yiming Wang",2024-06-07T16:52:57Z,2024-06-23T22:58:46Z,http://arxiv.org/abs/2406.05080v2,http://arxiv.org/pdf/2406.05080v2.pdf,all:ROS AND all:robot AND submittedDate:[202309062229 TO 202509052229],2024
"Experimental Evaluation of ROS-Causal in Real-World Human-Robot Spatial
  Interaction Scenarios","Deploying robots in human-shared environments requires a deep understanding
of how nearby agents and objects interact. Employing causal inference to model
cause-and-effect relationships facilitates the prediction of human behaviours
and enables the anticipation of robot interventions. However, a significant
challenge arises due to the absence of implementation of existing causal
discovery methods within the ROS ecosystem, the standard de-facto framework in
robotics, hindering effective utilisation on real robots. To bridge this gap,
in our previous work we proposed ROS-Causal, a ROS-based framework designed for
onboard data collection and causal discovery in human-robot spatial
interactions. In this work, we present an experimental evaluation of ROS-Causal
both in simulation and on a new dataset of human-robot spatial interactions in
a lab scenario, to assess its performance and effectiveness. Our analysis
demonstrates the efficacy of this approach, showcasing how causal models can be
extracted directly onboard by robots during data collection. The online causal
models generated from the simulation are consistent with those from lab
experiments. These findings can help researchers to enhance the performance of
robotic systems in shared environments, firstly by studying the causal
relations between variables in simulation without real people, and then
facilitating the actual robot deployment in real human environments.
ROS-Causal: https://lcastri.github.io/roscausal","Luca Castri, Gloria Beraldo, Sariah Mghames, Marc Hanheide, Nicola Bellotto",2024-06-07T14:20:30Z,2024-06-07T14:20:30Z,http://arxiv.org/abs/2406.04955v1,http://arxiv.org/pdf/2406.04955v1.pdf,all:ROS AND all:robot AND submittedDate:[202309062229 TO 202509052229],2024
"Advancing The Robotics Software Development Experience: Bridging Julia's
  Performance and Python's Ecosystem","Robotics programming typically involves a trade-off between the ease of use
offered by Python and the run-time performance of C++. While multi-language
architectures address this trade-off by coupling Python's ergonomics with C++'s
speed, they introduce complexity at the language interface. This paper proposes
using Julia for performance-critical tasks within Python ROS 2 applications,
providing an elegant solution that streamlines the development process without
disrupting the existing Python workflow.","Gustavo Nunes Goretkin, Joseph Carpinelli, Andy Park",2024-06-06T01:41:12Z,2024-06-06T01:41:12Z,http://arxiv.org/abs/2406.03677v1,http://arxiv.org/pdf/2406.03677v1.pdf,all:ROS AND all:robot AND submittedDate:[202309062229 TO 202509052229],2024
"An Open and Reconfigurable User Interface to Manage Complex ROS-based
  Robotic Systems","The Robot Operating System (ROS) has significantly gained popularity among
robotic engineers and researchers over the past five years, primarily due to
its powerful infrastructure for node communication, which enables developers to
build modular and large robotic applications. However, ROS presents a steep
learning curve and lacks the intuitive usability of vendor-specific robotic
Graphical User Interfaces (GUIs). Moreover, its modular and distributed nature
complicates the control and monitoring of extensive systems, even for advanced
users. To address these challenges, this paper proposes a highly adaptable and
reconfigurable web-based GUI for intuitively controlling, monitoring, and
configuring complex ROS-based robotic systems. The GUI leverages ROSBridge and
roslibjs to ensure seamless communication with ROS systems via topics and
services. Designed as a versatile platform, the GUI allows for the selective
incorporation of modular features to accommodate diverse robotic systems and
applications. An initial set of commonly used features in robotic applications
is presented. To demonstrate its reconfigurability, the GUI was customized and
tested for four industrial use cases, receiving positive feedback. The
project's repository has been made publicly available to support the robotics
community and lower the entry barrier for ROS in industrial applications.","Pablo Malvido Fresnillo, Saigopal Vasudevan, Jose A. Perez Garcia, Jose L. Martinez Lastra",2024-06-04T11:07:31Z,2024-06-04T11:07:31Z,http://arxiv.org/abs/2406.02210v1,http://arxiv.org/pdf/2406.02210v1.pdf,all:ROS AND all:robot AND submittedDate:[202309062229 TO 202509052229],2024
"A Robust Filter for Marker-less Multi-person Tracking in Human-Robot
  Interaction Scenarios","Pursuing natural and marker-less human-robot interaction (HRI) has been a
long-standing robotics research focus, driven by the vision of seamless
collaboration without physical markers. Marker-less approaches promise an
improved user experience, but state-of-the-art struggles with the challenges
posed by intrinsic errors in human pose estimation (HPE) and depth cameras.
These errors can lead to issues such as robot jittering, which can
significantly impact the trust users have in collaborative systems. We propose
a filtering pipeline that refines incomplete 3D human poses from an HPE
backbone and a single RGB-D camera to address these challenges, solving for
occlusions that can degrade the interaction. Experimental results show that
using the proposed filter leads to more consistent and noise-free motion
representation, reducing unexpected robot movements and enabling smoother
interaction.","Enrico Martini, Harshil Parekh, Shaoting Peng, Nicola Bombieri, Nadia Figueroa",2024-06-03T22:59:53Z,2024-06-03T22:59:53Z,http://arxiv.org/abs/2406.01832v1,http://arxiv.org/pdf/2406.01832v1.pdf,all:ROS AND all:robot AND submittedDate:[202309062229 TO 202509052229],2024
"The use of a humanoid robot for older people with dementia in aged care
  facilities","This paper presents an interdisciplinary PhD project using a humanoid robot
to encourage interactive activities for people with dementia living in two aged
care facilities. The aim of the project was to develop software and use
technologies to achieve successful robot-led engagement with older people with
dementia. This paper outlines the qualitative findings from the project's
feasibility stage. The researcher's observations, the participants' attitudes
and the feedback from carers are presented and discussed.","Dongjun Wu, Lihui Pu, Jun Jo, Rene Hexel, Wendy Moyle",2024-05-30T02:33:09Z,2024-05-30T02:33:09Z,http://arxiv.org/abs/2405.19630v1,http://arxiv.org/pdf/2405.19630v1.pdf,all:ROS AND all:robot AND submittedDate:[202309062229 TO 202509052229],2024
"Photorealistic Robotic Simulation using Unreal Engine 5 for Agricultural
  Applications","This work presents a new robotics simulation environment built upon Unreal
Engine 5 (UE5) for agricultural image data generation. The simulation utilizes
the state-of-the-art real-time rendering engine to provide realistic plant
images which are often used in agricultural applications. This study showcases
the rendering accuracy of UE5 in comparison to existing tools and assesses its
positional accuracy when integrated with Robot Operating Systems (ROS). The
results indicate that UE5 achieves an impressive average distance error of
0.021mm when compared to predetermined setpoints in a multi-robot setup
involving two UR10 arms.","Xingjian Li, Lirong Xiang",2024-05-28T19:40:27Z,2024-05-28T19:40:27Z,http://arxiv.org/abs/2405.18551v1,http://arxiv.org/pdf/2405.18551v1.pdf,all:ROS AND all:robot AND submittedDate:[202309062229 TO 202509052229],2024
"""Pass the butter"": A study on desktop-classic multitasking robotic arm
  based on advanced YOLOv7 and BERT","In recent years, various intelligent autonomous robots have begun to appear
in daily life and production. Desktop-level robots are characterized by their
flexible deployment, rapid response, and suitability for light workload
environments. In order to meet the current societal demand for service robot
technology, this study proposes using a miniaturized desktop-level robot (by
ROS) as a carrier, locally deploying a natural language model (NLP-BERT), and
integrating visual recognition (CV-YOLO) and speech recognition technology
(ASR-Whisper) as inputs to achieve autonomous decision-making and rational
action by the desktop robot. Three comprehensive experiments were designed to
validate the robotic arm, and the results demonstrate excellent performance
using this approach across all three experiments. In Task 1, the execution
rates for speech recognition and action performance were 92.6% and 84.3%,
respectively. In Task 2, the highest execution rates under the given conditions
reached 92.1% and 84.6%, while in Task 3, the highest execution rates were
95.2% and 80.8%, respectively. Therefore, it can be concluded that the proposed
solution integrating ASR, NLP, and other technologies on edge devices is
feasible and provides a technical and engineering foundation for realizing
multimodal desktop-level robots.","Haohua Que, Wenbin Pan, Jie Xu, Hao Luo, Pei Wang, Li Zhang",2024-05-27T15:06:03Z,2024-05-27T15:06:03Z,http://arxiv.org/abs/2405.17250v1,http://arxiv.org/pdf/2405.17250v1.pdf,all:ROS AND all:robot AND submittedDate:[202309062229 TO 202509052229],2024
Automated Parking Planning with Vision-Based BEV Approach,"Automated Valet Parking (AVP) is a crucial component of advanced autonomous
driving systems, focusing on the endpoint task within the ""human-vehicle
interaction"" process to tackle the challenges of the ""last mile"".The perception
module of the automated parking algorithm has evolved from local perception
using ultrasonic radar and global scenario precise map matching for
localization to a high-level map-free Birds Eye View (BEV) perception
solution.The BEV scene places higher demands on the real-time performance and
safety of automated parking planning tasks. This paper proposes an improved
automated parking algorithm based on the A* algorithm, integrating vehicle
kinematic models, heuristic function optimization, bidirectional search, and
Bezier curve optimization to enhance the computational speed and real-time
capabilities of the planning algorithm.Numerical optimization methods are
employed to generate the final parking trajectory, ensuring the safety of the
parking path. The proposed approach is experimentally validated in the commonly
used industrial CARLA-ROS joint simulation environment. Compared to traditional
algorithms, this approach demonstrates reduced computation time with more
challenging collision-risk test cases and improved performance in comfort
metrics.",Yuxuan Zhao,2024-05-24T15:26:09Z,2024-05-24T15:26:09Z,http://arxiv.org/abs/2406.15430v1,http://arxiv.org/pdf/2406.15430v1.pdf,all:ROS AND all:robot AND submittedDate:[202309062229 TO 202509052229],2024
"Towards Privacy-Aware and Personalised Assistive Robots: A User-Centred
  Approach","The global increase in the elderly population necessitates innovative
long-term care solutions to improve the quality of life for vulnerable
individuals while reducing caregiver burdens. Assistive robots, leveraging
advancements in Machine Learning, offer promising personalised support.
However, their integration into daily life raises significant privacy concerns.
Widely used frameworks like the Robot Operating System (ROS) historically lack
inherent privacy mechanisms, complicating data-driven approaches in robotics.
This research pioneers user-centric, privacy-aware technologies such as
Federated Learning (FL) to advance assistive robotics. FL enables collaborative
learning without sharing sensitive data, addressing privacy and scalability
issues. This work includes developing solutions for smart wheelchair
assistance, enhancing user independence and well-being. By tackling challenges
related to non-stationary data and heterogeneous environments, the research
aims to improve personalisation and user experience. Ultimately, it seeks to
lead the responsible integration of assistive robots into society, enhancing
the quality of life for elderly and care-dependent individuals.",Fernando E. Casado,2024-05-23T13:14:08Z,2024-05-23T13:14:08Z,http://arxiv.org/abs/2405.14528v1,http://arxiv.org/pdf/2405.14528v1.pdf,all:ROS AND all:robot AND submittedDate:[202309062229 TO 202509052229],2024
"Towards Using Fast Embedded Model Predictive Control for Human-Aware
  Predictive Robot Navigation","Predictive planning is a key capability for robots to efficiently and safely
navigate populated environments. Particularly in densely crowded scenes, with
uncertain human motion predictions, predictive path planning, and control can
become expensive to compute in real time due to the curse of dimensionality.
With the goal of achieving pro-active and legible robot motion in shared
environments, in this paper we present HuMAN-MPC, a computationally efficient
algorithm for Human Motion Aware Navigation using fast embedded Model
Predictive Control. The approach consists of a novel model predictive control
(MPC) formulation that leverages a fast state-of-the-art optimization backend
based on a sequential quadratic programming real-time iteration scheme while
also providing feasibility monitoring. Our experiments, in simulation and on a
fully integrated ROS-based platform, show that the approach achieves great
scalability with fast computation times without penalizing path quality and
efficiency of the resulting avoidance behavior.","Till Hielscher, Lukas Heuer, Frederik Wulle, Luigi Palmieri",2024-05-21T09:12:16Z,2024-05-21T09:12:16Z,http://arxiv.org/abs/2405.12616v1,http://arxiv.org/pdf/2405.12616v1.pdf,all:ROS AND all:robot AND submittedDate:[202309062229 TO 202509052229],2024
"EdgeLoc: A Communication-Adaptive Parallel System for Real-Time
  Localization in Infrastructure-Assisted Autonomous Driving","This paper presents EdgeLoc, an infrastructure-assisted, real-time
localization system for autonomous driving that addresses the incompatibility
between traditional localization methods and deep learning approaches. The
system is built on top of the Robot Operating System (ROS) and combines the
real-time performance of traditional methods with the high accuracy of deep
learning approaches. The system leverages edge computing capabilities of
roadside units (RSUs) for precise localization to enhance on-vehicle
localization that is based on the real-time visual odometry. EdgeLoc is a
parallel processing system, utilizing a proposed uncertainty-aware pose fusion
solution. It achieves communication adaptivity through online learning and
addresses fluctuations via window-based detection. Moreover, it achieves
optimal latency and maximum improvement by utilizing auto-splitting
vehicle-infrastructure collaborative inference, as well as online distribution
learning for decision-making. Even with the most basic end-to-end deep neural
network for localization estimation, EdgeLoc realizes a 67.75\% reduction in
the localization error for real-time local visual odometry, a 29.95\% reduction
for non-real-time collaborative inference, and a 30.26\% reduction compared to
Kalman filtering. Finally, accuracy-to-latency conversion was experimentally
validated, and an overall experiment was conducted on a practical cellular
network. The system is open sourced at
https://github.com/LoganCome/EdgeAssistedLocalization.","Boyi Liu, Jingwen Tong, Yufan Zhuang",2024-05-20T15:38:53Z,2024-06-08T06:55:32Z,http://arxiv.org/abs/2405.12120v2,http://arxiv.org/pdf/2405.12120v2.pdf,all:ROS AND all:robot AND submittedDate:[202309062229 TO 202509052229],2024
Reward-Punishment Reinforcement Learning with Maximum Entropy,"We introduce the ``soft Deep MaxPain'' (softDMP) algorithm, which integrates
the optimization of long-term policy entropy into reward-punishment
reinforcement learning objectives. Our motivation is to facilitate a smoother
variation of operators utilized in the updating of action values beyond
traditional ``max'' and ``min'' operators, where the goal is enhancing sample
efficiency and robustness. We also address two unresolved issues from the
previous Deep MaxPain method. Firstly, we investigate how the negated
(``flipped'') pain-seeking sub-policy, derived from the punishment action
value, collaborates with the ``min'' operator to effectively learn the
punishment module and how softDMP's smooth learning operator provides insights
into the ``flipping'' trick. Secondly, we tackle the challenge of data
collection for learning the punishment module to mitigate inconsistencies
arising from the involvement of the ``flipped'' sub-policy (pain-avoidance
sub-policy) in the unified behavior policy. We empirically explore the first
issue in two discrete Markov Decision Process (MDP) environments, elucidating
the crucial advancements of the DMP approach and the necessity for soft
treatments on the hard operators. For the second issue, we propose a
probabilistic classifier based on the ratio of the pain-seeking sub-policy to
the sum of the pain-seeking and goal-reaching sub-policies. This classifier
assigns roll-outs to separate replay buffers for updating reward and punishment
action-value functions, respectively. Our framework demonstrates superior
performance in Turtlebot 3's maze navigation tasks under the ROS Gazebo
simulation.","Jiexin Wang, Eiji Uchibe",2024-05-20T05:05:14Z,2024-05-20T05:05:14Z,http://arxiv.org/abs/2405.11784v1,http://arxiv.org/pdf/2405.11784v1.pdf,all:ROS AND all:robot AND submittedDate:[202309062229 TO 202509052229],2024
"Advancements in Gravity Compensation and Control for the da Vinci
  Surgical Robot","This research delves into the enhancement of control mechanisms for the da
Vinci Surgical System, focusing on the implementation of gravity compensation
and refining the modeling of the master and patient side manipulators.
Leveraging the Robot Operating System (ROS) the study aimed to fortify the
precision and stability of the robots movements essential for intricate
surgical procedures. Through rigorous parameter identification and the Euler
Lagrange approach the team successfully derived the necessary torque equations
and established a robust mathematical model. Implementation of the actual robot
and simulation in Gazebo highlighted the efficacy of the developed control
strategies facilitating accurate positioning and minimizing drift.
Additionally, the project extended its contributions by constructing a
comprehensive model for the patient side manipulator laying the groundwork for
future research endeavors. This work signifies a significant advancement in the
pursuit of enhanced precision and user control in robotic assisted surgeries.
  NOTE - This work has been submitted to the IEEE for publication. Copyright
may be transferred without notice, after which this version may no longer be
accessible. Copyright on this article is reserved by IEEE",Ankit Shaw,2024-05-17T23:02:20Z,2024-08-01T15:40:40Z,http://arxiv.org/abs/2405.11114v2,http://arxiv.org/pdf/2405.11114v2.pdf,all:ROS AND all:robot AND submittedDate:[202309062229 TO 202509052229],2024
Fast LiDAR Upsampling using Conditional Diffusion Models,"The search for refining 3D LiDAR data has attracted growing interest
motivated by recent techniques such as supervised learning or generative
model-based methods. Existing approaches have shown the possibilities for using
diffusion models to generate refined LiDAR data with high fidelity, although
the performance and speed of such methods have been limited. These limitations
make it difficult to execute in real-time, causing the approaches to struggle
in real-world tasks such as autonomous navigation and human-robot interaction.
In this work, we introduce a novel approach based on conditional diffusion
models for fast and high-quality sparse-to-dense upsampling of 3D scene point
clouds through an image representation. Our method employs denoising diffusion
probabilistic models trained with conditional inpainting masks, which have been
shown to give high performance on image completion tasks. We introduce a series
of experiments, including multiple datasets, sampling steps, and conditional
masks. This paper illustrates that our method outperforms the baselines in
sampling speed and quality on upsampling tasks using the KITTI-360 dataset.
Furthermore, we illustrate the generalization ability of our approach by
simultaneously training on real-world and synthetic datasets, introducing
variance in quality and environments.","Sander Elias Magnussen Helgesen, Kazuto Nakashima, Jim Tørresen, Ryo Kurazume",2024-05-08T08:38:28Z,2024-07-23T06:51:06Z,http://arxiv.org/abs/2405.04889v2,http://arxiv.org/pdf/2405.04889v2.pdf,all:ROS AND all:robot AND submittedDate:[202309062229 TO 202509052229],2024
